PRIMER NOMBRE;SEGUNDO NOMBRE;APELLIDO PATERNO;APELLIDO MATERNO;TIPO IDENTIFICACION;CEDULA/PASAPORTE;RUC;TELEFONO;CELULAR;CORREO;DESCRIPCION DE SOCIO;TIPO DE SOCIO;SUCURSAL REGISTRO;FECHA NACIMIENTO;GENERO;DISCAPACIDAD;ESTADO CIVIL;Nro CARGAS FAMILIARES;DOMICILIO CALLE PRINCIPAL;DOMICILIO CALLE SECUNDARIA;DOMICILIO Nro Vivienda;DOMICILIO PROVINCIA;DOMICILIO CANTON;DOMICILIO PARROQUIA;DOMICILIO BARRIO;DOMICILIO REFERENCIA;ACTIVIDAD ECONOMICA;NEGOCIO CALLE PRINCIPAL;NEGOCIO CALLE SECUNDARIA;NEGOCIO Nro Vivienda;NEGOCIO PROVINCIA;NEGOCIO CANTON;NEGOCIO PARROQUIA;NEGOCIO BARRIO;NEGOCIO REFERENCIA
Sarah;Donald;Ramirez;Montgomery;C;1002003000;;7-(294)469-2202;9-(090)673-0494;dmontgomery7c@netvibes.com;;CLIENTE;Mira;02/02/2014;M;NO;VIUDO;2;;East;91;Poland;China;China;China;Etiam vel augue. Vestibulum rutrum rutrum neque. Aenean auctor gravida sem.;Lechero;Ridgeway;Portage;2283;China;China;China;China;Aliquam quis turpis eget elit sodales scelerisque. Mauris sit amet eros. Suspendisse accumsan tortor quis turpis.
Ronald;Kimberly;Hill;Porter;C;1002003000;;7-(638)857-3928;6-(416)697-8503;kporter7d@blogger.com;;CLIENTE;Urcuqui;13/11/2014;F;NO;SOLTERO;3;Farmco;Anthes;1;Sweden;China;;China;Nulla ut erat id mauris vulputate elementum. Nullam varius. Nulla facilisi.;Mecánico;Bay;Lillian;5797;China;China;China;China;Curabitur at ipsum ac tellus semper interdum. Mauris ullamcorper purus sit amet nulla. Quisque arcu libero, rutrum ac, lobortis vel, dapibus at, diam.
Gary;Aaron;Austin;Robinson;C;1002003000;;4-(108)582-6171;6-(900)286-3215;;;CLIENTE;Mira;26/09/2014;M;NO;SOLTERO;2;;Bay;0;United States;Syria;Syria;Syria;Maecenas leo odio, condimentum id, luctus nec, molestie sed, justo. Pellentesque viverra pede ac diam. Cras pellentesque volutpat dui.;Escultor;Marcy;Graedel;4;Syria;Syria;Syria;Syria;Aliquam quis turpis eget elit sodales scelerisque. Mauris sit amet eros. Suspendisse accumsan tortor quis turpis.
Jesse;Jessica;Kelly;Rodriguez;C;1002003000;;3-(109)966-5618;1-(068)287-9629;;Phasellus sit amet erat. Nulla tempus. Vivamus in felis eu sapien cursus vestibulum.;CLIENTE;El Angel;07/07/2014;F;NO;DIVORCIADO;1;Oak;Eggendart;236;Sweden;Albania;Albania;Albania;Lorem ipsum dolor sit amet, consectetuer adipiscing elit. Proin risus. Praesent lectus.;Carnicero;Jenifer;Caliangt;8;Albania;Albania;Albania;Albania;Integer ac leo. Pellentesque ultrices mattis odio. Donec vitae nisi.
Keith;Roger;Lane;Young;C;1004002000;;7-(551)572-9104;7-(449)251-1423;;;CLIENTE;Pimampiro;06/10/2014;F;NO;DIVORCIADO;4;Main;Redwing;32600;Indonesia;Russia;Russia;Russia;Fusce posuere felis sed lacus. Morbi sem mauris, laoreet ut, rhoncus aliquet, pulvinar sed, nisl. Nunc rhoncus dui vel sem.;Comerciante;Forest Dale;6th;5;;Russia;Russia;Russia;Duis bibendum, felis sed interdum venenatis, turpis enim blandit mi, in porttitor pede justo eu massa. Donec dapibus. Duis at velit eu est congue elementum.
Jennifer;Diane;Adams;Garrett;C;1004002000;;0-(395)986-8330;3-(564)306-7050;;;CLIENTE;Mira;;M;NO;VIUDO;3;Macpherson;Dorton;5;Indonesia;Armenia;Armenia;Armenia;Duis bibendum, felis sed interdum venenatis, turpis enim blandit mi, in porttitor pede justo eu massa. Donec dapibus. Duis at velit eu est congue elementum.;Escultor;Delladonna;East;974;;Armenia;Armenia;Armenia;Etiam vel augue. Vestibulum rutrum rutrum neque. Aenean auctor gravida sem.
Phillip;Jason;George;Wheeler;C;1004002000;;6-(633)686-2210;9-(879)533-3182;jwheeler7i@indiegogo.com;"Praesent id massa id nisl venenatis lacinia. Aenean sit amet justo. Morbi ut odio.

Cras mi pede, malesuada in, imperdiet et, commodo vulputate, justo. In blandit ultrices enim. Lorem ipsum dolor sit amet, consectetuer adipiscing elit.";CLIENTE;Pimampiro;20/03/2014;M;NO;CASADO;1;Crest Line;Waywood;19808;Japan;Philippines;Philippines;Philippines;Suspendisse potenti. In eleifend quam a odio. In hac habitasse platea dictumst.;Carnicero;Ridgeview;Colorado;23;Philippines;Philippines;Philippines;Philippines;Proin interdum mauris non ligula pellentesque ultrices. Phasellus id sapien in sapien iaculis congue. Vivamus metus arcu, adipiscing molestie, hendrerit at, vulputate vitae, nisl.
Theresa;Mary;Fuller;Gibson;C;1002003000;;5-(794)097-7035;7-(828)139-0011;;"Duis consequat dui nec nisi volutpat eleifend. Donec ut dolor. Morbi vel lectus in quam fringilla rhoncus.

Mauris enim leo, rhoncus sed, vestibulum sit amet, cursus id, turpis. Integer aliquet, massa id lobortis convallis, tortor risus dapibus augue, vel accumsan tellus nisi eu orci. Mauris lacinia sapien quis libero.";CLIENTE;Pimampiro;13/01/2014;M;NO;CASADO;1;Gateway;Iowa;3696;Madagascar;China;China;China;Pellentesque at nulla. Suspendisse potenti. Cras in purus eu magna vulputate luctus.;Artesano;North;Kipling;6519;;China;China;China;Pellentesque at nulla. Suspendisse potenti. Cras in purus eu magna vulputate luctus.
Brian;Joe;Bailey;Ray;C;1004002000;;7-(498)610-7411;0-(383)314-7404;jray7k@jigsy.com;;CLIENTE;Pimampiro;19/09/2014;F;NO;CASADO;;Gulseth;Saint Paul;7;Indonesia;Vietnam;Vietnam;Vietnam;Morbi non lectus. Aliquam sit amet diam in magna bibendum imperdiet. Nullam orci pede, venenatis non, sodales sed, tincidunt eu, felis.;Panadero;Nelson;Cottonwood;8;Vietnam;Vietnam;Vietnam;Vietnam;In quis justo. Maecenas rhoncus aliquam lacus. Morbi quis tortor id nulla ultrices aliquet.
Charles;Carol;Williamson;Marshall;C;1004002000;;8-(762)064-2185;3-(869)977-7229;cmarshall7l@tripadvisor.com;;CLIENTE;El Angel;19/08/2014;M;NO;VIUDO;3;1st;Katie;150;Russia;Russia;Russia;Russia;Duis bibendum, felis sed interdum venenatis, turpis enim blandit mi, in porttitor pede justo eu massa. Donec dapibus. Duis at velit eu est congue elementum.;Comerciante;Sloan;Florence;;Russia;Russia;Russia;Russia;In congue. Etiam justo. Etiam pretium iaculis justo.
Timothy;Adam;Kelley;Butler;C;1002003000;;8-(989)681-6868;4-(920)731-9078;abutler7m@livejournal.com;In hac habitasse platea dictumst. Morbi vestibulum, velit id pretium iaculis, diam erat fermentum justo, nec condimentum neque sapien placerat ante. Nulla justo.;CLIENTE;Urcuqui;03/01/2014;M;;VIUDO;3;Ohio;Anniversary;63675;Qatar;Philippines;Philippines;Philippines;Curabitur in libero ut massa volutpat convallis. Morbi odio odio, elementum eu, interdum eu, tincidunt in, leo. Maecenas pulvinar lobortis est.;Lechero;6th;;716;Philippines;Philippines;;Philippines;Aenean fermentum. Donec ut mauris eget massa tempor convallis. Nulla neque libero, convallis eget, eleifend luctus, ultricies eu, nibh.
Steven;;Spencer;Moore;C;1002003000;;3-(411)017-4656;1-(229)907-6475;;Aliquam quis turpis eget elit sodales scelerisque. Mauris sit amet eros. Suspendisse accumsan tortor quis turpis.;CLIENTE;Urcuqui;18/09/2014;F;NO;SOLTERO;4;Calypso;Shelley;85324;Peru;China;China;China;Sed ante. Vivamus tortor. Duis mattis egestas metus.;Artesano;Sachs;Golf View;65395;China;China;China;China;In quis justo. Maecenas rhoncus aliquam lacus. Morbi quis tortor id nulla ultrices aliquet.
Nicholas;Wanda;Collins;Carter;C;1002003000;;0-(891)898-2905;8-(663)518-0403;wcarter7o@arstechnica.com;"Aenean fermentum. Donec ut mauris eget massa tempor convallis. Nulla neque libero, convallis eget, eleifend luctus, ultricies eu, nibh.

Quisque id justo sit amet sapien dignissim vestibulum. Vestibulum ante ipsum primis in faucibus orci luctus et ultrices posuere cubilia Curae; Nulla dapibus dolor vel est. Donec odio justo, sollicitudin ut, suscipit a, feugiat et, eros.";GARANTE;Pimampiro;31/03/2014;F;NO;DIVORCIADO;2;Corscot;Holmberg;905;France;China;China;China;Proin leo odio, porttitor id, consequat in, consequat ut, nulla. Sed accumsan felis. Ut at dolor quis odio consequat varius.;Escultor;Old Shore;;8;China;China;China;China;Mauris enim leo, rhoncus sed, vestibulum sit amet, cursus id, turpis. Integer aliquet, massa id lobortis convallis, tortor risus dapibus augue, vel accumsan tellus nisi eu orci. Mauris lacinia sapien quis libero.
Rebecca;Clarence;King;Daniels;C;1004002000;;7-(336)856-4236;6-(353)373-8598;cdaniels7p@reddit.com;"Nam ultrices, libero non mattis pulvinar, nulla pede ullamcorper augue, a suscipit nulla elit ac nulla. Sed vel enim sit amet nunc viverra dapibus. Nulla suscipit ligula in lacus.

Curabitur at ipsum ac tellus semper interdum. Mauris ullamcorper purus sit amet nulla. Quisque arcu libero, rutrum ac, lobortis vel, dapibus at, diam.";CLIENTE;Mira;27/07/2014;F;NO;CASADO;2;Golf View;Rowland;3;China;Poland;Poland;Poland;Nullam sit amet turpis elementum ligula vehicula consequat. Morbi a ipsum. Integer a nibh.;Panadero;Comanche;Lawn;330;Poland;Poland;Poland;Poland;In quis justo. Maecenas rhoncus aliquam lacus. Morbi quis tortor id nulla ultrices aliquet.
Cynthia;Thomas;Bowman;Nichols;C;1004002000;;9-(953)155-5192;;;;CLIENTE;El Angel;10/03/2014;F;NO;VIUDO;2;Killdeer;Sauthoff;7535;South Africa;China;China;China;Sed ante. Vivamus tortor. Duis mattis egestas metus.;Digitado;;Burrows;5;China;China;China;;Fusce consequat. Nulla nisl. Nunc nisl.
Daniel;Carolyn;Meyer;Mills;C;1002003000;;9-(139)597-1048;7-(688)082-9349;;Phasellus sit amet erat. Nulla tempus. Vivamus in felis eu sapien cursus vestibulum.;CLIENTE;Urcuqui;25/02/2014;F;NO;SOLTERO;1;Canary;Miller;3;Japan;Indonesia;Indonesia;Indonesia;Proin interdum mauris non ligula pellentesque ultrices. Phasellus id sapien in sapien iaculis congue. Vivamus metus arcu, adipiscing molestie, hendrerit at, vulputate vitae, nisl.;Comerciante;Westridge;Menomonie;;Indonesia;Indonesia;Indonesia;Indonesia;Nullam porttitor lacus at turpis. Donec posuere metus vitae ipsum. Aliquam non mauris.
Tammy;Maria;Shaw;Alvarez;C;1004002000;;6-(119)625-1892;7-(439)025-7651;;Phasellus sit amet erat. Nulla tempus. Vivamus in felis eu sapien cursus vestibulum.;CLIENTE;Mira;06/12/2013;M;NO;VIUDO;;Express;Sauthoff;92;Egypt;Turkmenistan;Turkmenistan;Turkmenistan;"Vestibulum quam sapien, varius ut, blandit non, interdum in, ante. Vestibulum ante ipsum primis in faucibus orci luctus et ultrices posuere cubilia Curae; Duis faucibus accumsan odio. Curabitur convallis.";Costurero;Merry;;9622;Turkmenistan;;Turkmenistan;Turkmenistan;Integer tincidunt ante vel ipsum. Praesent blandit lacinia erat. Vestibulum sed magna at nunc commodo placerat.
Ashley;Alan;Adams;Ray;C;1004002000;;4-(314)071-2805;1-(967)986-3417;aray7t@123-reg.co.uk;;CLIENTE;El Angel;16/07/2014;M;NO;SOLTERO;4;Spaight;Helena;31972;Ukraine;United States;United States;United States;"Quisque id justo sit amet sapien dignissim vestibulum. Vestibulum ante ipsum primis in faucibus orci luctus et ultrices posuere cubilia Curae; Nulla dapibus dolor vel est. Donec odio justo, sollicitudin ut, suscipit a, feugiat et, eros.";Costurero;Morning;Manley;18071;United States;United States;;United States;Aliquam quis turpis eget elit sodales scelerisque. Mauris sit amet eros. Suspendisse accumsan tortor quis turpis.
Larry;Jesse;Morris;Ford;C;1002003000;;7-(390)608-2862;4-(821)022-4064;jford7u@51.la;;CLIENTE;Mira;16/12/2013;M;NO;DIVORCIADO;3;Linden;Lerdahl;865;China;China;China;China;Integer ac leo. Pellentesque ultrices mattis odio. Donec vitae nisi.;Digitado;Burrows;Wayridge;852;China;China;China;China;In quis justo. Maecenas rhoncus aliquam lacus. Morbi quis tortor id nulla ultrices aliquet.
James;Thomas;Morris;Kim;C;1004002000;;3-(823)731-5433;7-(452)609-5505;;"Maecenas leo odio, condimentum id, luctus nec, molestie sed, justo. Pellentesque viverra pede ac diam. Cras pellentesque volutpat dui.

Maecenas tristique, est et tempus semper, est quam pharetra magna, ac consequat metus sapien ut nunc. Vestibulum ante ipsum primis in faucibus orci luctus et ultrices posuere cubilia Curae; Mauris viverra diam vitae quam. Suspendisse potenti.";CLIENTE;El Angel;25/01/2014;M;NO;CASADO;4;Alpine;Scott;180;Spain;Seychelles;Seychelles;Seychelles;Sed ante. Vivamus tortor. Duis mattis egestas metus.;Lechero;Chive;Petterle;41;Seychelles;Seychelles;Seychelles;Seychelles;Morbi porttitor lorem id ligula. Suspendisse ornare consequat lectus. In est risus, auctor sed, tristique in, tempus sit amet, sem.
Laura;Walter;Vasquez;Rivera;C;1004002000;;5-(659)046-1803;6-(136)777-1306;wrivera7w@kickstarter.com;Nullam sit amet turpis elementum ligula vehicula consequat. Morbi a ipsum. Integer a nibh.;CLIENTE;El Angel;02/06/2014;M;;SOLTERO;3;Mallory;Lakewood Gardens;38;Zambia;Portugal;Portugal;Portugal;"Donec diam neque, vestibulum eget, vulputate ut, ultrices vel, augue. Vestibulum ante ipsum primis in faucibus orci luctus et ultrices posuere cubilia Curae; Donec pharetra, magna vestibulum aliquet ultrices, erat tortor sollicitudin mi, sit amet lobortis sapien sapien non mi. Integer ac neque.";Digitado;Clemons;Packers;12387;Portugal;Portugal;Portugal;Portugal;In hac habitasse platea dictumst. Morbi vestibulum, velit id pretium iaculis, diam erat fermentum justo, nec condimentum neque sapien placerat ante. Nulla justo.
Russell;Jeremy;Hawkins;Andrews;C;1004002000;;2-(328)053-4626;6-(189)499-2885;;;CLIENTE;;03/12/2013;F;NO;SOLTERO;0;;Bartelt;9903;China;Brazil;Brazil;Brazil;Mauris enim leo, rhoncus sed, vestibulum sit amet, cursus id, turpis. Integer aliquet, massa id lobortis convallis, tortor risus dapibus augue, vel accumsan tellus nisi eu orci. Mauris lacinia sapien quis libero.;Carnicero;Anderson;Florence;357;Brazil;Brazil;Brazil;Brazil;Lorem ipsum dolor sit amet, consectetuer adipiscing elit. Proin risus. Praesent lectus.
Jason;Donna;Larson;Turner;C;1002003000;;3-(598)343-1219;4-(162)330-2946;dturner7y@scientificamerican.com;;CLIENTE;Mira;13/07/2014;F;NO;DIVORCIADO;;Waywood;Cardinal;;Colombia;China;China;China;Vestibulum ac est lacinia nisi venenatis tristique. Fusce congue, diam id ornare imperdiet, sapien urna pretium nisl, ut volutpat sapien arcu sed augue. Aliquam erat volutpat.;Mecánico;Gateway;Stephen;420;China;China;China;China;In quis justo. Maecenas rhoncus aliquam lacus. Morbi quis tortor id nulla ultrices aliquet.
Sandra;Juan;Wheeler;Walker;C;1004002000;;5-(755)421-5218;4-(003)155-8762;;;CLIENTE;Mira;24/04/2014;M;NO;CASADO;;Walton;Carey;1;China;Indonesia;Indonesia;;Proin interdum mauris non ligula pellentesque ultrices. Phasellus id sapien in sapien iaculis congue. Vivamus metus arcu, adipiscing molestie, hendrerit at, vulputate vitae, nisl.;Lechero;Golf;Thompson;55884;Indonesia;Indonesia;Indonesia;;Duis bibendum. Morbi non quam nec dui luctus rutrum. Nulla tellus.
Heather;Eric;Ramirez;Webb;C;1004002000;;2-(377)343-5765;3-(133)496-7588;ewebb80@lycos.com;;CLIENTE;Mira;04/03/2014;F;NO;DIVORCIADO;;Bartillon;Carpenter;33;Canada;Botswana;Botswana;Botswana;Curabitur in libero ut massa volutpat convallis. Morbi odio odio, elementum eu, interdum eu, tincidunt in, leo. Maecenas pulvinar lobortis est.;Mecánico;Waywood;Helena;55446;Botswana;;Botswana;Botswana;Curabitur in libero ut massa volutpat convallis. Morbi odio odio, elementum eu, interdum eu, tincidunt in, leo. Maecenas pulvinar lobortis est.
Joan;Christine;King;;C;1004002000;;3-(671)347-7843;0-(339)884-3043;cpalmer81@engadget.com;Praesent blandit. Nam nulla. Integer pede justo, lacinia eget, tincidunt eget, tempus vel, pede.;CLIENTE;El Angel;29/03/2014;M;SI;VIUDO;;Rusk;Forest Run;5019;Philippines;North Korea;North Korea;North Korea;Duis bibendum, felis sed interdum venenatis, turpis enim blandit mi, in porttitor pede justo eu massa. Donec dapibus. Duis at velit eu est congue elementum.;Escultor;Lillian;Forest Run;18509;North Korea;North Korea;North Korea;North Korea;
Jerry;Louise;Garcia;Lawson;C;1004002000;;3-(174)713-9883;6-(308)182-5387;;"In hac habitasse platea dictumst. Morbi vestibulum, velit id pretium iaculis, diam erat fermentum justo, nec condimentum neque sapien placerat ante. Nulla justo.

Aliquam quis turpis eget elit sodales scelerisque. Mauris sit amet eros. Suspendisse accumsan tortor quis turpis.";CLIENTE;Mira;23/09/2014;M;NO;DIVORCIADO;1;Drewry;Burrows;1;Indonesia;New Zealand;New Zealand;New Zealand;Nam ultrices, libero non mattis pulvinar, nulla pede ullamcorper augue, a suscipit nulla elit ac nulla. Sed vel enim sit amet nunc viverra dapibus. Nulla suscipit ligula in lacus.;Carnicero;Service;Elka;935;New Zealand;New Zealand;New Zealand;;Quisque porta volutpat erat. Quisque erat eros, viverra eget, congue eget, semper rutrum, nulla. Nunc purus.
Kimberly;Carol;Mccoy;;P;1002003000;;4-(604)160-1977;8-(321)795-6946;cgray83@paypal.com;;CLIENTE;Mira;29/04/2014;M;NO;SOLTERO;1;Melvin;Twin Pines;200;China;Philippines;Philippines;Philippines;Aenean fermentum. Donec ut mauris eget massa tempor convallis. Nulla neque libero, convallis eget, eleifend luctus, ultricies eu, nibh.;Mecánico;Pine View;Memorial;13468;Philippines;Philippines;Philippines;Philippines;Proin leo odio, porttitor id, consequat in, consequat ut, nulla. Sed accumsan felis. Ut at dolor quis odio consequat varius.
Jennifer;Andrew;Ramirez;Taylor;C;1002003000;;7-(862)750-1064;;;"Fusce consequat. Nulla nisl. Nunc nisl.

Duis bibendum, felis sed interdum venenatis, turpis enim blandit mi, in porttitor pede justo eu massa. Donec dapibus. Duis at velit eu est congue elementum.";CLIENTE;Pimampiro;31/01/2014;M;NO;CASADO;;Northview;Autumn Leaf;13;Turkmenistan;China;China;China;In congue. Etiam justo. Etiam pretium iaculis justo.;Escultor;Stone Corner;Tomscot;737;China;China;China;China;Suspendisse potenti. In eleifend quam a odio. In hac habitasse platea dictumst.
Laura;Emily;Daniels;Arnold;C;1002003000;;8-(795)940-8670;2-(323)069-2209;;Maecenas leo odio, condimentum id, luctus nec, molestie sed, justo. Pellentesque viverra pede ac diam. Cras pellentesque volutpat dui.;CLIENTE;Urcuqui;07/11/2014;M;NO;SOLTERO;3;Kenwood;Loftsgordon;61479;Ecuador;Portugal;Portugal;Portugal;Proin interdum mauris non ligula pellentesque ultrices. Phasellus id sapien in sapien iaculis congue. Vivamus metus arcu, adipiscing molestie, hendrerit at, vulputate vitae, nisl.;Comerciante;;Beilfuss;36;Portugal;Portugal;Portugal;Portugal;Nullam sit amet turpis elementum ligula vehicula consequat. Morbi a ipsum. Integer a nibh.
Kimberly;Jeffrey;White;Warren;C;1004002000;;9-(032)214-6608;6-(912)405-0521;;;CLIENTE;;31/08/2014;F;NO;SOLTERO;2;Oneill;Corry;7;Pakistan;France;France;France;Aliquam quis turpis eget elit sodales scelerisque. Mauris sit amet eros. Suspendisse accumsan tortor quis turpis.;Lechero;David;Drewry;0;France;France;France;France;Suspendisse potenti. In eleifend quam a odio. In hac habitasse platea dictumst.
Doris;Scott;Morales;Young;C;1002003000;;9-(478)804-0947;8-(828)606-6007;syoung87@gizmodo.com;"Quisque id justo sit amet sapien dignissim vestibulum. Vestibulum ante ipsum primis in faucibus orci luctus et ultrices posuere cubilia Curae; Nulla dapibus dolor vel est. Donec odio justo, sollicitudin ut, suscipit a, feugiat et, eros.

Vestibulum ac est lacinia nisi venenatis tristique. Fusce congue, diam id ornare imperdiet, sapien urna pretium nisl, ut volutpat sapien arcu sed augue. Aliquam erat volutpat.";CLIENTE;Pimampiro;27/04/2014;M;NO;VIUDO;0;Walton;Coleman;9;Guatemala;China;China;China;Suspendisse potenti. In eleifend quam a odio. In hac habitasse platea dictumst.;Tendero;;Tomscot;1;China;China;China;China;Suspendisse potenti. In eleifend quam a odio. In hac habitasse platea dictumst.
Phyllis;Rebecca;Richardson;Walker;C;1002003000;;0-(497)195-1738;;;;CLIENTE;Mira;17/04/2014;F;NO;CASADO;0;Nevada;Hazelcrest;465;Ghana;Philippines;Philippines;Philippines;;Mecánico;Drewry;Ridgeview;41438;;Philippines;Philippines;Philippines;"Maecenas tristique, est et tempus semper, est quam pharetra magna, ac consequat metus sapien ut nunc. Vestibulum ante ipsum primis in faucibus orci luctus et ultrices posuere cubilia Curae; Mauris viverra diam vitae quam. Suspendisse potenti."
Teresa;Samuel;Lewis;Jones;C;1004002000;;0-(333)410-9621;9-(667)073-4858;;;CLIENTE;Mira;03/01/2014;M;NO;SOLTERO;3;Novick;Mifflin;8908;China;Iran;Iran;Iran;Nullam porttitor lacus at turpis. Donec posuere metus vitae ipsum. Aliquam non mauris.;Escultor;Maple Wood;Chinook;33;Iran;Iran;Iran;Iran;Praesent blandit. Nam nulla. Integer pede justo, lacinia eget, tincidunt eget, tempus vel, pede.
Justin;Cheryl;Alvarez;Cooper;C;1002003000;;1-(083)829-9319;3-(330)389-9454;ccooper8a@whitehouse.gov;"Etiam vel augue. Vestibulum rutrum rutrum neque. Aenean auctor gravida sem.

Praesent id massa id nisl venenatis lacinia. Aenean sit amet justo. Morbi ut odio.";CLIENTE;Pimampiro;13/09/2014;M;NO;DIVORCIADO;1;Mandrake;Orin;327;Sweden;Syria;Syria;Syria;;Carnicero;Aberg;Harper;2667;;Syria;Syria;Syria;In quis justo. Maecenas rhoncus aliquam lacus. Morbi quis tortor id nulla ultrices aliquet.
Jean;Mary;Simmons;Berry;C;1004002000;;8-(408)750-3524;2-(092)328-1194;mberry8b@sbwire.com;"Quisque id justo sit amet sapien dignissim vestibulum. Vestibulum ante ipsum primis in faucibus orci luctus et ultrices posuere cubilia Curae; Nulla dapibus dolor vel est. Donec odio justo, sollicitudin ut, suscipit a, feugiat et, eros.

Vestibulum ac est lacinia nisi venenatis tristique. Fusce congue, diam id ornare imperdiet, sapien urna pretium nisl, ut volutpat sapien arcu sed augue. Aliquam erat volutpat.";CLIENTE;Mira;17/01/2014;M;NO;SOLTERO;4;Monica;Straubel;58914;Philippines;China;China;China;Maecenas leo odio, condimentum id, luctus nec, molestie sed, justo. Pellentesque viverra pede ac diam. Cras pellentesque volutpat dui.;Mecánico;Oriole;Dawn;10359;China;;China;China;Curabitur gravida nisi at nibh. In hac habitasse platea dictumst. Aliquam augue quam, sollicitudin vitae, consectetuer eget, rutrum at, lorem.
Cynthia;Benjamin;Hunt;Alexander;C;1002003000;;4-(180)289-5740;0-(358)857-5022;balexander8c@google.co.uk;"Nullam porttitor lacus at turpis. Donec posuere metus vitae ipsum. Aliquam non mauris.

Morbi non lectus. Aliquam sit amet diam in magna bibendum imperdiet. Nullam orci pede, venenatis non, sodales sed, tincidunt eu, felis.";CLIENTE;Mira;08/02/2014;M;NO;DIVORCIADO;0;Gerald;Fulton;913;Slovenia;Brazil;Brazil;Brazil;Curabitur gravida nisi at nibh. In hac habitasse platea dictumst. Aliquam augue quam, sollicitudin vitae, consectetuer eget, rutrum at, lorem.;Costurero;Continental;Rusk;6841;Brazil;Brazil;Brazil;Brazil;"Maecenas tristique, est et tempus semper, est quam pharetra magna, ac consequat metus sapien ut nunc. Vestibulum ante ipsum primis in faucibus orci luctus et ultrices posuere cubilia Curae; Mauris viverra diam vitae quam. Suspendisse potenti."
Rose;Ryan;Vasquez;;C;1004002000;;5-(025)490-3677;5-(580)452-2384;;"Maecenas tristique, est et tempus semper, est quam pharetra magna, ac consequat metus sapien ut nunc. Vestibulum ante ipsum primis in faucibus orci luctus et ultrices posuere cubilia Curae; Mauris viverra diam vitae quam. Suspendisse potenti.

Nullam porttitor lacus at turpis. Donec posuere metus vitae ipsum. Aliquam non mauris.";CLIENTE;El Angel;28/02/2014;F;NO;SOLTERO;4;Monument;Rockefeller;560;Indonesia;Argentina;Argentina;Argentina;Integer tincidunt ante vel ipsum. Praesent blandit lacinia erat. Vestibulum sed magna at nunc commodo placerat.;Heladero;Carioca;Amoth;53;Argentina;Argentina;Argentina;Argentina;Proin eu mi. Nulla ac enim. In tempor, turpis nec euismod scelerisque, quam turpis adipiscing lorem, vitae mattis nibh ligula nec sem.
Melissa;Susan;Tucker;Hanson;C;1004002000;;7-(000)296-8483;5-(482)325-3795;;"Phasellus in felis. Donec semper sapien a libero. Nam dui.

Proin leo odio, porttitor id, consequat in, consequat ut, nulla. Sed accumsan felis. Ut at dolor quis odio consequat varius.";CLIENTE;Mira;31/10/2014;M;NO;SOLTERO;3;Alpine;Red Cloud;4;Bolivia;China;China;China;Morbi non lectus. Aliquam sit amet diam in magna bibendum imperdiet. Nullam orci pede, venenatis non, sodales sed, tincidunt eu, felis.;Tendero;;Judy;117;China;China;China;China;Phasellus sit amet erat. Nulla tempus. Vivamus in felis eu sapien cursus vestibulum.
Phyllis;Tina;Hunter;Spencer;P;1002003000;;4-(805)917-9709;0-(042)131-4344;tspencer8f@redcross.org;;CLIENTE;Mira;21/04/2014;M;NO;CASADO;3;Calypso;Summit;347;China;Argentina;Argentina;Argentina;Duis bibendum, felis sed interdum venenatis, turpis enim blandit mi, in porttitor pede justo eu massa. Donec dapibus. Duis at velit eu est congue elementum.;Tendero;Magdeline;Towne;6830;Argentina;Argentina;Argentina;Argentina;Lorem ipsum dolor sit amet, consectetuer adipiscing elit. Proin risus. Praesent lectus.
Gerald;Adam;George;Chavez;C;1002003000;;1-(476)732-6346;3-(344)090-0241;achavez8g@wunderground.com;"Maecenas ut massa quis augue luctus tincidunt. Nulla mollis molestie lorem. Quisque ut erat.

Curabitur gravida nisi at nibh. In hac habitasse platea dictumst. Aliquam augue quam, sollicitudin vitae, consectetuer eget, rutrum at, lorem.";CLIENTE;Pimampiro;22/03/2014;M;NO;VIUDO;2;;Golf;1;French Polynesia;Indonesia;Indonesia;Indonesia;In hac habitasse platea dictumst. Etiam faucibus cursus urna. Ut tellus.;Carnicero;Eastlawn;Dryden;22;Indonesia;Indonesia;Indonesia;Indonesia;"Donec diam neque, vestibulum eget, vulputate ut, ultrices vel, augue. Vestibulum ante ipsum primis in faucibus orci luctus et ultrices posuere cubilia Curae; Donec pharetra, magna vestibulum aliquet ultrices, erat tortor sollicitudin mi, sit amet lobortis sapien sapien non mi. Integer ac neque."
Gary;Joan;Russell;Burton;P;1004002000;;3-(835)582-4153;9-(279)764-0877;jburton8h@macromedia.com;;CLIENTE;Mira;14/07/2014;F;NO;CASADO;0;Hermina;Meadow Valley;7857;Vietnam;Uganda;Uganda;Uganda;Curabitur gravida nisi at nibh. In hac habitasse platea dictumst. Aliquam augue quam, sollicitudin vitae, consectetuer eget, rutrum at, lorem.;Panadero;Village;Bartillon;6;Uganda;Uganda;Uganda;Uganda;Maecenas leo odio, condimentum id, luctus nec, molestie sed, justo. Pellentesque viverra pede ac diam. Cras pellentesque volutpat dui.
