PRIMER NOMBRE;SEGUNDO NOMBRE;APELLIDO PATERNO;APELLIDO MATERNO;TIPO IDENTIFICACION;CEDULA/PASAPORTE;RUC;TELEFONO;CELULAR;CORREO;DESCRIPCION DE SOCIO;TIPO DE SOCIO;SUCURSAL REGISTRO;FECHA NACIMIENTO;GENERO;DISCAPACIDAD;ESTADO CIVIL;Nro CARGAS FAMILIARES;DOMICILIO CALLE PRINCIPAL;DOMICILIO CALLE SECUNDARIA;DOMICILIO Nro Vivienda;DOMICILIO PROVINCIA;DOMICILIO CANTON;DOMICILIO PARROQUIA;DOMICILIO BARRIO;DOMICILIO REFERENCIA;ACTIVIDAD ECONOMICA;NEGOCIO CALLE PRINCIPAL;NEGOCIO CALLE SECUNDARIA;NEGOCIO Nro Vivienda;NEGOCIO PROVINCIA;NEGOCIO CANTON;NEGOCIO PARROQUIA;NEGOCIO BARRIO;NEGOCIO REFERENCIA
Philip;Martha;Butler;Dixon;C;1002003000;;3-(582)038-7298;1-(575)551-1015;;;CLIENTE;Pimampiro;07/05/2014;M;NO;CASADO;0;Loomis;Cordelia;42045;Indonesia;Tunisia;Tunisia;Tunisia;In hac habitasse platea dictumst. Etiam faucibus cursus urna. Ut tellus.;Lechero;Elgar;School;6;Tunisia;Tunisia;Tunisia;Tunisia;Aliquam quis turpis eget elit sodales scelerisque. Mauris sit amet eros. Suspendisse accumsan tortor quis turpis.
Jason;Jeffrey;Freeman;Bennett;C;1002003000;;2-(803)860-4311;7-(292)647-8118;jbennettjn@cnet.com;;CLIENTE;Urcuqui;15/05/2014;M;;CASADO;2;Del Mar;;356;China;Bulgaria;Bulgaria;Bulgaria;Morbi porttitor lorem id ligula. Suspendisse ornare consequat lectus. In est risus, auctor sed, tristique in, tempus sit amet, sem.;Tendero;Cambridge;Ilene;62;Bulgaria;Bulgaria;Bulgaria;Bulgaria;Duis aliquam convallis nunc. Proin at turpis a pede posuere nonummy. Integer non velit.
Phillip;Christopher;Patterson;Wilson;C;1004002000;;9-(620)552-7944;8-(266)517-0961;cwilsonjo@storify.com;;CLIENTE;Urcuqui;27/05/2014;F;NO;VIUDO;;Dahle;Gulseth;4;Ukraine;;Azerbaijan;;Cras non velit nec nisi vulputate nonummy. Maecenas tincidunt lacus at velit. Vivamus vel nulla eget eros elementum pellentesque.;Escultor;Texas;Farwell;47;Azerbaijan;Azerbaijan;Azerbaijan;Azerbaijan;Nam ultrices, libero non mattis pulvinar, nulla pede ullamcorper augue, a suscipit nulla elit ac nulla. Sed vel enim sit amet nunc viverra dapibus. Nulla suscipit ligula in lacus.
Harry;Brian;Ramos;Hamilton;C;1004002000;;6-(828)727-8103;1-(720)193-8956;;"Fusce posuere felis sed lacus. Morbi sem mauris, laoreet ut, rhoncus aliquet, pulvinar sed, nisl. Nunc rhoncus dui vel sem.

Sed sagittis. Nam congue, risus semper porta volutpat, quam pede lobortis ligula, sit amet eleifend pede libero quis orci. Nullam molestie nibh in lectus.";CLIENTE;Pimampiro;05/12/2013;F;SI;CASADO;;Mcguire;;78504;Russia;Japan;Japan;Japan;"Maecenas tristique, est et tempus semper, est quam pharetra magna, ac consequat metus sapien ut nunc. Vestibulum ante ipsum primis in faucibus orci luctus et ultrices posuere cubilia Curae; Mauris viverra diam vitae quam. Suspendisse potenti.";Carnicero;Di Loreto;Vermont;3;Japan;Japan;Japan;Japan;Fusce consequat. Nulla nisl. Nunc nisl.
Ann;Ryan;Washington;Martin;C;1002003000;;2-(013)161-5942;5-(845)222-2848;rmartinjq@sakura.ne.jp;"Phasellus in felis. Donec semper sapien a libero. Nam dui.

Proin leo odio, porttitor id, consequat in, consequat ut, nulla. Sed accumsan felis. Ut at dolor quis odio consequat varius.";CLIENTE;Urcuqui;25/09/2014;F;SI;CASADO;3;Hazelcrest;Sugar;9958;Portugal;Canada;Canada;;Praesent blandit. Nam nulla. Integer pede justo, lacinia eget, tincidunt eget, tempus vel, pede.;Heladero;;Sutherland;;Canada;Canada;Canada;Canada;Praesent blandit. Nam nulla. Integer pede justo, lacinia eget, tincidunt eget, tempus vel, pede.
Diane;Peter;Allen;Fox;C;1002003000;;9-(768)132-6481;1-(639)189-8731;pfoxjr@youtu.be;;CLIENTE;El Angel;02/08/2014;F;NO;CASADO;1;Pankratz;Arizona;5956;Portugal;China;China;China;Integer tincidunt ante vel ipsum. Praesent blandit lacinia erat. Vestibulum sed magna at nunc commodo placerat.;Costurero;Kenwood;Claremont;6;China;China;China;China;Quisque porta volutpat erat. Quisque erat eros, viverra eget, congue eget, semper rutrum, nulla. Nunc purus.
Mary;Ernest;Sims;Woods;C;1004002000;;8-(940)653-8704;8-(965)325-5850;ewoodsjs@princeton.edu;;CLIENTE;El Angel;01/02/2014;F;NO;SOLTERO;2;Nevada;Holy Cross;45;Indonesia;Poland;Poland;Poland;Fusce posuere felis sed lacus. Morbi sem mauris, laoreet ut, rhoncus aliquet, pulvinar sed, nisl. Nunc rhoncus dui vel sem.;Panadero;Atwood;Messerschmidt;9;Poland;Poland;Poland;Poland;Duis aliquam convallis nunc. Proin at turpis a pede posuere nonummy. Integer non velit.
Tina;Frances;Clark;Reynolds;C;1004002000;;3-(066)875-0536;4-(025)604-6320;freynoldsjt@t.co;Integer ac leo. Pellentesque ultrices mattis odio. Donec vitae nisi.;CLIENTE;Urcuqui;20/03/2014;M;NO;VIUDO;2;Elgar;Loeprich;29;China;Thailand;Thailand;Thailand;"Quisque id justo sit amet sapien dignissim vestibulum. Vestibulum ante ipsum primis in faucibus orci luctus et ultrices posuere cubilia Curae; Nulla dapibus dolor vel est. Donec odio justo, sollicitudin ut, suscipit a, feugiat et, eros.";Mecánico;Victoria;Cardinal;3990;Thailand;Thailand;Thailand;Thailand;Fusce consequat. Nulla nisl. Nunc nisl.
Anna;Donald;Willis;;C;1004002000;;9-(792)290-4990;3-(946)248-2239;;;CLIENTE;Mira;28/02/2014;M;NO;SOLTERO;;Clemons;Hollow Ridge;243;Democratic Republic of the Congo;Indonesia;Indonesia;Indonesia;Etiam vel augue. Vestibulum rutrum rutrum neque. Aenean auctor gravida sem.;Tendero;Meadow Ridge;Mockingbird;958;Indonesia;Indonesia;Indonesia;Indonesia;Cras non velit nec nisi vulputate nonummy. Maecenas tincidunt lacus at velit. Vivamus vel nulla eget eros elementum pellentesque.
Rachel;William;Smith;Smith;C;1002003000;;0-(435)910-7694;7-(621)250-5729;;In congue. Etiam justo. Etiam pretium iaculis justo.;CLIENTE;Mira;16/03/2014;M;NO;CASADO;;East;Montana;;Sweden;China;China;China;Integer tincidunt ante vel ipsum. Praesent blandit lacinia erat. Vestibulum sed magna at nunc commodo placerat.;Carnicero;Bunker Hill;Jana;2002;China;China;China;China;Nullam sit amet turpis elementum ligula vehicula consequat. Morbi a ipsum. Integer a nibh.
Paul;Wayne;Wood;Ward;P;1004002000;;0-(975)307-1825;2-(261)819-3649;;;GARANTE;Pimampiro;13/02/2014;M;NO;SOLTERO;0;Rusk;Waubesa;5;;Peru;Peru;Peru;;Panadero;Ridgeview;Quincy;480;Peru;Peru;Peru;Peru;In congue. Etiam justo. Etiam pretium iaculis justo.
Annie;Katherine;Washington;Perry;C;1002003000;;8-(706)751-0358;3-(292)687-5339;;;CLIENTE;Mira;22/06/2014;F;NO;SOLTERO;1;Carberry;3rd;67470;Pakistan;Morocco;Morocco;Morocco;Vestibulum ac est lacinia nisi venenatis tristique. Fusce congue, diam id ornare imperdiet, sapien urna pretium nisl, ut volutpat sapien arcu sed augue. Aliquam erat volutpat.;Escultor;Talisman;Farwell;874;Morocco;Morocco;Morocco;Morocco;Nam ultrices, libero non mattis pulvinar, nulla pede ullamcorper augue, a suscipit nulla elit ac nulla. Sed vel enim sit amet nunc viverra dapibus. Nulla suscipit ligula in lacus.
Jonathan;Eugene;Gilbert;Berry;P;1002003000;;2-(304)040-8106;1-(943)493-7899;;;CLIENTE;El Angel;16/03/2014;M;NO;VIUDO;;Kropf;Manufacturers;42;Bosnia and Herzegovina;Philippines;Philippines;Philippines;Sed ante. Vivamus tortor. Duis mattis egestas metus.;Heladero;;Crescent Oaks;85;Philippines;Philippines;Philippines;Philippines;"Vestibulum quam sapien, varius ut, blandit non, interdum in, ante. Vestibulum ante ipsum primis in faucibus orci luctus et ultrices posuere cubilia Curae; Duis faucibus accumsan odio. Curabitur convallis."
Melissa;Barbara;Jenkins;James;C;1002003000;;8-(703)267-9719;0-(404)114-9651;bjamesjz@skype.com;"Fusce consequat. Nulla nisl. Nunc nisl.

Duis bibendum, felis sed interdum venenatis, turpis enim blandit mi, in porttitor pede justo eu massa. Donec dapibus. Duis at velit eu est congue elementum.";CLIENTE;Pimampiro;14/01/2014;F;NO;;2;Warrior;Northview;256;Poland;China;;China;In congue. Etiam justo. Etiam pretium iaculis justo.;Artesano;Derek;Dwight;79;China;China;China;China;Curabitur at ipsum ac tellus semper interdum. Mauris ullamcorper purus sit amet nulla. Quisque arcu libero, rutrum ac, lobortis vel, dapibus at, diam.
Anna;Michelle;Sims;Cook;C;1004002000;;2-(053)186-0379;5-(431)346-5851;mcookk0@oracle.com;Duis bibendum, felis sed interdum venenatis, turpis enim blandit mi, in porttitor pede justo eu massa. Donec dapibus. Duis at velit eu est congue elementum.;CLIENTE;Pimampiro;31/08/2014;M;SI;SOLTERO;2;Derek;Harbort;3;China;France;France;France;Pellentesque at nulla. Suspendisse potenti. Cras in purus eu magna vulputate luctus.;Heladero;Transport;Red Cloud;39752;France;France;France;France;Sed ante. Vivamus tortor. Duis mattis egestas metus.
Richard;Aaron;Morales;Fowler;C;1002003000;;9-(361)027-0215;6-(971)387-1984;;"Proin eu mi. Nulla ac enim. In tempor, turpis nec euismod scelerisque, quam turpis adipiscing lorem, vitae mattis nibh ligula nec sem.

Duis aliquam convallis nunc. Proin at turpis a pede posuere nonummy. Integer non velit.";CLIENTE;Urcuqui;01/12/2013;M;NO;SOLTERO;;Old Gate;Mallory;93;Portugal;Japan;;Japan;Integer tincidunt ante vel ipsum. Praesent blandit lacinia erat. Vestibulum sed magna at nunc commodo placerat.;Lechero;Grasskamp;Clarendon;16066;Japan;Japan;Japan;Japan;Aenean lectus. Pellentesque eget nunc. Donec quis orci eget orci vehicula condimentum.
Dorothy;Andrew;Gomez;Wright;C;1002003000;;8-(664)057-8163;9-(390)682-2192;;"Integer tincidunt ante vel ipsum. Praesent blandit lacinia erat. Vestibulum sed magna at nunc commodo placerat.

Praesent blandit. Nam nulla. Integer pede justo, lacinia eget, tincidunt eget, tempus vel, pede.";CLIENTE;Pimampiro;29/06/2014;M;NO;VIUDO;4;Parkside;Hauk;55362;China;China;;China;Nulla ut erat id mauris vulputate elementum. Nullam varius. Nulla facilisi.;Lechero;Quincy;Meadow Valley;65510;China;China;China;China;Curabitur gravida nisi at nibh. In hac habitasse platea dictumst. Aliquam augue quam, sollicitudin vitae, consectetuer eget, rutrum at, lorem.
Kenneth;Marilyn;Ortiz;Cole;P;1004002000;;5-(622)319-5932;9-(232)191-8958;mcolek3@pen.io;;CLIENTE;Pimampiro;08/06/2014;M;NO;SOLTERO;1;Hanover;Coolidge;;China;Greece;Greece;Greece;Duis bibendum, felis sed interdum venenatis, turpis enim blandit mi, in porttitor pede justo eu massa. Donec dapibus. Duis at velit eu est congue elementum.;Tendero;Roth;Hintze;407;Greece;Greece;Greece;Greece;Cum sociis natoque penatibus et magnis dis parturient montes, nascetur ridiculus mus. Vivamus vestibulum sagittis sapien. Cum sociis natoque penatibus et magnis dis parturient montes, nascetur ridiculus mus.
Amy;;Franklin;Mcdonald;C;1004002000;;7-(552)902-2372;4-(090)125-3704;mmcdonaldk4@mapy.cz;;CLIENTE;Mira;30/09/2014;M;NO;CASADO;4;Kingsford;Hoepker;74383;China;China;China;China;Curabitur gravida nisi at nibh. In hac habitasse platea dictumst. Aliquam augue quam, sollicitudin vitae, consectetuer eget, rutrum at, lorem.;Digitado;Monica;Morning;760;China;China;China;China;Etiam vel augue. Vestibulum rutrum rutrum neque. Aenean auctor gravida sem.
Arthur;Frank;Diaz;Fuller;C;1002003000;;2-(115)335-2510;8-(106)918-1527;;;CLIENTE;El Angel;23/02/2014;F;NO;SOLTERO;1;Cambridge;Luster;53;;France;France;France;"Maecenas tristique, est et tempus semper, est quam pharetra magna, ac consequat metus sapien ut nunc. Vestibulum ante ipsum primis in faucibus orci luctus et ultrices posuere cubilia Curae; Mauris viverra diam vitae quam. Suspendisse potenti.";Comerciante;;Acker;8;France;France;France;France;Curabitur at ipsum ac tellus semper interdum. Mauris ullamcorper purus sit amet nulla. Quisque arcu libero, rutrum ac, lobortis vel, dapibus at, diam.
Jerry;Paul;Weaver;Watson;C;1004002000;;2-(015)809-1476;5-(438)369-2840;;Aliquam quis turpis eget elit sodales scelerisque. Mauris sit amet eros. Suspendisse accumsan tortor quis turpis.;GARANTE;Pimampiro;05/06/2014;M;SI;SOLTERO;;Main;Dryden;5;Portugal;Israel;Israel;Israel;Proin eu mi. Nulla ac enim. In tempor, turpis nec euismod scelerisque, quam turpis adipiscing lorem, vitae mattis nibh ligula nec sem.;Costurero;Ridge Oak;Bowman;45415;Israel;Israel;Israel;Israel;In sagittis dui vel nisl. Duis ac nibh. Fusce lacus purus, aliquet at, feugiat non, pretium quis, lectus.
Arthur;Stephen;Oliver;Gilbert;C;1002003000;;3-(535)665-1868;7-(760)513-7218;sgilbertk7@unc.edu;Nullam porttitor lacus at turpis. Donec posuere metus vitae ipsum. Aliquam non mauris.;CLIENTE;Urcuqui;13/09/2014;M;NO;SOLTERO;;East;Spenser;63123;Russia;Russia;Russia;Russia;Proin eu mi. Nulla ac enim. In tempor, turpis nec euismod scelerisque, quam turpis adipiscing lorem, vitae mattis nibh ligula nec sem.;Digitado;Kings;Division;26672;Russia;Russia;Russia;Russia;In quis justo. Maecenas rhoncus aliquam lacus. Morbi quis tortor id nulla ultrices aliquet.
Jacqueline;Evelyn;Ryan;Parker;C;1002003000;;8-(685)021-8269;8-(052)582-3974;;;CLIENTE;Urcuqui;14/04/2014;F;NO;CASADO;1;Thackeray;Iowa;273;Poland;South Africa;South Africa;South Africa;Pellentesque at nulla. Suspendisse potenti. Cras in purus eu magna vulputate luctus.;Artesano;Village Green;La Follette;618;South Africa;South Africa;South Africa;South Africa;Praesent id massa id nisl venenatis lacinia. Aenean sit amet justo. Morbi ut odio.
Heather;Adam;Carroll;Reynolds;C;1002003000;;8-(725)993-1659;0-(896)094-2022;;;CLIENTE;Urcuqui;12/08/2014;F;NO;SOLTERO;3;Butternut;Sheridan;6318;Philippines;Poland;Poland;Poland;Duis consequat dui nec nisi volutpat eleifend. Donec ut dolor. Morbi vel lectus in quam fringilla rhoncus.;Lechero;Rutledge;Stang;3955;Poland;Poland;Poland;Poland;Mauris enim leo, rhoncus sed, vestibulum sit amet, cursus id, turpis. Integer aliquet, massa id lobortis convallis, tortor risus dapibus augue, vel accumsan tellus nisi eu orci. Mauris lacinia sapien quis libero.
Jimmy;;Chavez;Garcia;P;1004002000;;1-(579)027-0632;5-(332)955-2295;agarciaka@discuz.net;Mauris enim leo, rhoncus sed, vestibulum sit amet, cursus id, turpis. Integer aliquet, massa id lobortis convallis, tortor risus dapibus augue, vel accumsan tellus nisi eu orci. Mauris lacinia sapien quis libero.;CLIENTE;;29/09/2014;F;NO;DIVORCIADO;2;Ilene;Havey;9443;South Korea;Canada;Canada;Canada;Suspendisse potenti. In eleifend quam a odio. In hac habitasse platea dictumst.;Lechero;Westport;Village;134;Canada;Canada;Canada;Canada;Morbi non lectus. Aliquam sit amet diam in magna bibendum imperdiet. Nullam orci pede, venenatis non, sodales sed, tincidunt eu, felis.
Irene;Roger;Elliott;Jackson;C;1002003000;;2-(607)553-8593;1-(498)304-4281;;;CLIENTE;Mira;18/11/2013;M;NO;SOLTERO;2;;Novick;2;France;Bulgaria;Bulgaria;Bulgaria;Quisque porta volutpat erat. Quisque erat eros, viverra eget, congue eget, semper rutrum, nulla. Nunc purus.;Escultor;6th;Myrtle;465;Bulgaria;Bulgaria;Bulgaria;Bulgaria;Duis aliquam convallis nunc. Proin at turpis a pede posuere nonummy. Integer non velit.
Janet;Andrea;Hunter;Sims;C;1004002000;;1-(149)350-4034;6-(711)190-4328;;;CLIENTE;Urcuqui;03/06/2014;F;NO;CASADO;1;Carpenter;Steensland;84;Philippines;Russia;Russia;Russia;In hac habitasse platea dictumst. Morbi vestibulum, velit id pretium iaculis, diam erat fermentum justo, nec condimentum neque sapien placerat ante. Nulla justo.;Comerciante;Bayside;Crownhardt;8359;Russia;Russia;Russia;Russia;Lorem ipsum dolor sit amet, consectetuer adipiscing elit. Proin risus. Praesent lectus.
Sandra;Justin;Stanley;Medina;C;1002003000;;7-(031)612-4479;;;"Nullam sit amet turpis elementum ligula vehicula consequat. Morbi a ipsum. Integer a nibh.

In quis justo. Maecenas rhoncus aliquam lacus. Morbi quis tortor id nulla ultrices aliquet.";CLIENTE;El Angel;;F;NO;SOLTERO;3;Clyde Gallagher;Lunder;82734;China;Poland;Poland;Poland;Proin leo odio, porttitor id, consequat in, consequat ut, nulla. Sed accumsan felis. Ut at dolor quis odio consequat varius.;Escultor;Ruskin;Karstens;9975;Poland;Poland;Poland;Poland;"Maecenas tristique, est et tempus semper, est quam pharetra magna, ac consequat metus sapien ut nunc. Vestibulum ante ipsum primis in faucibus orci luctus et ultrices posuere cubilia Curae; Mauris viverra diam vitae quam. Suspendisse potenti."
Patrick;Russell;Watson;Duncan;C;1002003000;;3-(886)854-3880;8-(897)582-9202;;In sagittis dui vel nisl. Duis ac nibh. Fusce lacus purus, aliquet at, feugiat non, pretium quis, lectus.;CLIENTE;Mira;27/03/2014;M;NO;SOLTERO;0;Mallard;Thompson;55915;Portugal;Indonesia;Indonesia;;Curabitur gravida nisi at nibh. In hac habitasse platea dictumst. Aliquam augue quam, sollicitudin vitae, consectetuer eget, rutrum at, lorem.;Artesano;Mockingbird;Lien;915;Indonesia;Indonesia;Indonesia;Indonesia;Suspendisse potenti. In eleifend quam a odio. In hac habitasse platea dictumst.
Kathy;Steve;Welch;Howell;C;1002003000;;8-(164)355-2248;8-(412)752-1883;;;CLIENTE;Pimampiro;05/04/2014;F;SI;CASADO;;Kings;Jenna;14258;Indonesia;Poland;Poland;Poland;Integer tincidunt ante vel ipsum. Praesent blandit lacinia erat. Vestibulum sed magna at nunc commodo placerat.;Mecánico;Burrows;Pine View;210;Poland;Poland;Poland;Poland;"Donec diam neque, vestibulum eget, vulputate ut, ultrices vel, augue. Vestibulum ante ipsum primis in faucibus orci luctus et ultrices posuere cubilia Curae; Donec pharetra, magna vestibulum aliquet ultrices, erat tortor sollicitudin mi, sit amet lobortis sapien sapien non mi. Integer ac neque."
Richard;Janice;Alexander;Ward;C;1004002000;;;7-(813)450-6603;jwardkg@stanford.edu;Cras mi pede, malesuada in, imperdiet et, commodo vulputate, justo. In blandit ultrices enim. Lorem ipsum dolor sit amet, consectetuer adipiscing elit.;CLIENTE;Urcuqui;22/12/2013;M;SI;CASADO;3;Bunting;Hagan;4213;Russia;Thailand;Thailand;Thailand;;Costurero;Swallow;Garrison;2481;;Thailand;Thailand;Thailand;Cras mi pede, malesuada in, imperdiet et, commodo vulputate, justo. In blandit ultrices enim. Lorem ipsum dolor sit amet, consectetuer adipiscing elit.
Antonio;Bonnie;Pierce;Castillo;C;1002003000;;5-(561)440-8411;4-(955)248-4680;bcastillokh@archive.org;In hac habitasse platea dictumst. Morbi vestibulum, velit id pretium iaculis, diam erat fermentum justo, nec condimentum neque sapien placerat ante. Nulla justo.;CLIENTE;Pimampiro;17/02/2014;M;NO;CASADO;1;2nd;Harbort;4765;;China;China;China;Fusce consequat. Nulla nisl. Nunc nisl.;Digitado;Shelley;Badeau;512;China;China;China;China;Cras mi pede, malesuada in, imperdiet et, commodo vulputate, justo. In blandit ultrices enim. Lorem ipsum dolor sit amet, consectetuer adipiscing elit.
Betty;Jeffrey;Riley;Dixon;C;1004002000;;2-(968)049-5644;1-(875)417-0979;jdixonki@engadget.com;;GARANTE;El Angel;13/04/2014;M;NO;SOLTERO;3;Bonner;Iowa;98;Russia;Cameroon;Cameroon;Cameroon;In quis justo. Maecenas rhoncus aliquam lacus. Morbi quis tortor id nulla ultrices aliquet.;Digitado;Jenna;;6783;Cameroon;Cameroon;Cameroon;Cameroon;Integer ac leo. Pellentesque ultrices mattis odio. Donec vitae nisi.
Ralph;Donald;Mitchell;Torres;C;1004002000;;2-(338)473-5294;9-(102)521-5746;;;GARANTE;El Angel;18/06/2014;M;SI;SOLTERO;;Eggendart;Talmadge;8287;Poland;Philippines;Philippines;Philippines;Praesent blandit. Nam nulla. Integer pede justo, lacinia eget, tincidunt eget, tempus vel, pede.;Panadero;Mifflin;Kropf;16;Philippines;Philippines;Philippines;Philippines;Morbi non lectus. Aliquam sit amet diam in magna bibendum imperdiet. Nullam orci pede, venenatis non, sodales sed, tincidunt eu, felis.
Rebecca;Jennifer;Morales;Carr;C;1004002000;;2-(124)460-3738;6-(558)107-7327;;;CLIENTE;Mira;03/08/2014;M;SI;SOLTERO;4;Sauthoff;Hudson;89;Iran;Russia;Russia;Russia;Nam ultrices, libero non mattis pulvinar, nulla pede ullamcorper augue, a suscipit nulla elit ac nulla. Sed vel enim sit amet nunc viverra dapibus. Nulla suscipit ligula in lacus.;Mecánico;Commercial;Oneill;62;Russia;Russia;Russia;Russia;Phasellus in felis. Donec semper sapien a libero. Nam dui.
Jonathan;Ernest;Nichols;Cruz;C;1002003000;;8-(337)769-5613;9-(599)768-7591;;In congue. Etiam justo. Etiam pretium iaculis justo.;CLIENTE;Urcuqui;09/10/2014;F;NO;DIVORCIADO;;Kennedy;Darwin;7067;Indonesia;China;China;China;Etiam vel augue. Vestibulum rutrum rutrum neque. Aenean auctor gravida sem.;Digitado;Florence;Westend;77;China;China;China;China;Nulla ut erat id mauris vulputate elementum. Nullam varius. Nulla facilisi.
Michael;Paula;Lewis;Franklin;C;1002003000;;5-(664)174-4109;8-(004)297-9076;;;CLIENTE;El Angel;02/04/2014;M;NO;CASADO;;Northridge;Pine View;26;Syria;Indonesia;Indonesia;Indonesia;Phasellus sit amet erat. Nulla tempus. Vivamus in felis eu sapien cursus vestibulum.;Comerciante;Superior;Garrison;7;Indonesia;Indonesia;Indonesia;Indonesia;Aliquam quis turpis eget elit sodales scelerisque. Mauris sit amet eros. Suspendisse accumsan tortor quis turpis.
Rebecca;Amanda;Garza;Rogers;C;1004002000;;4-(050)433-9293;2-(060)708-7067;arogerskn@deliciousdays.com;;GARANTE;Pimampiro;27/05/2014;F;SI;SOLTERO;3;Hovde;Grasskamp;765;Egypt;China;China;China;Quisque porta volutpat erat. Quisque erat eros, viverra eget, congue eget, semper rutrum, nulla. Nunc purus.;Escultor;Dorton;Heath;3376;China;China;China;China;Curabitur gravida nisi at nibh. In hac habitasse platea dictumst. Aliquam augue quam, sollicitudin vitae, consectetuer eget, rutrum at, lorem.
Ruth;Jimmy;Rice;Austin;C;1002003000;;0-(446)295-2981;3-(906)803-4982;jaustinko@cnn.com;;CLIENTE;Pimampiro;30/09/2014;M;NO;CASADO;;Russell;Ruskin;9171;Russia;Sweden;Sweden;Sweden;Aliquam quis turpis eget elit sodales scelerisque. Mauris sit amet eros. Suspendisse accumsan tortor quis turpis.;Mecánico;Pond;Mitchell;1573;Sweden;Sweden;Sweden;Sweden;Etiam vel augue. Vestibulum rutrum rutrum neque. Aenean auctor gravida sem.
Brandon;;Murray;Gonzales;C;1004002000;;5-(694)674-4539;0-(810)305-4967;;Proin leo odio, porttitor id, consequat in, consequat ut, nulla. Sed accumsan felis. Ut at dolor quis odio consequat varius.;GARANTE;Pimampiro;19/03/2014;M;NO;DIVORCIADO;2;Tennyson;Lillian;305;;China;China;China;Cras mi pede, malesuada in, imperdiet et, commodo vulputate, justo. In blandit ultrices enim. Lorem ipsum dolor sit amet, consectetuer adipiscing elit.;Panadero;Londonderry;Caliangt;490;China;China;China;China;Proin leo odio, porttitor id, consequat in, consequat ut, nulla. Sed accumsan felis. Ut at dolor quis odio consequat varius.
Lawrence;Carolyn;Warren;Nelson;C;1002003000;;8-(469)146-2752;7-(793)111-2659;;Praesent blandit. Nam nulla. Integer pede justo, lacinia eget, tincidunt eget, tempus vel, pede.;CLIENTE;Urcuqui;28/10/2014;M;NO;CASADO;1;Killdeer;Corry;6154;China;Argentina;Argentina;Argentina;Nullam porttitor lacus at turpis. Donec posuere metus vitae ipsum. Aliquam non mauris.;Panadero;Pankratz;Mallory;26;Argentina;Argentina;Argentina;Argentina;Nullam sit amet turpis elementum ligula vehicula consequat. Morbi a ipsum. Integer a nibh.
Sarah;Paul;Dixon;Perry;C;1004002000;;4-(711)753-6377;0-(966)553-6165;;In hac habitasse platea dictumst. Etiam faucibus cursus urna. Ut tellus.;CLIENTE;Mira;23/12/2013;M;SI;CASADO;2;Banding;Stuart;168;Egypt;Nicaragua;Nicaragua;Nicaragua;Cras non velit nec nisi vulputate nonummy. Maecenas tincidunt lacus at velit. Vivamus vel nulla eget eros elementum pellentesque.;Artesano;4th;7th;16936;Nicaragua;Nicaragua;Nicaragua;Nicaragua;Aenean lectus. Pellentesque eget nunc. Donec quis orci eget orci vehicula condimentum.
Anna;Brian;Hicks;Robinson;C;1002003000;;0-(219)579-9369;8-(583)813-4325;;Cras mi pede, malesuada in, imperdiet et, commodo vulputate, justo. In blandit ultrices enim. Lorem ipsum dolor sit amet, consectetuer adipiscing elit.;CLIENTE;Mira;21/07/2014;F;NO;SOLTERO;;Delaware;Roth;46;France;France;France;France;Suspendisse potenti. In eleifend quam a odio. In hac habitasse platea dictumst.;Digitado;American Ash;Crowley;37;France;France;France;France;
Jimmy;Cheryl;Knight;Carr;C;1002003000;;9-(483)691-1966;5-(272)309-3250;ccarrkt@feedburner.com;;CLIENTE;Mira;17/11/2013;F;NO;SOLTERO;;Grasskamp;Bultman;7220;Sudan;Lebanon;Lebanon;Lebanon;Aenean lectus. Pellentesque eget nunc. Donec quis orci eget orci vehicula condimentum.;Lechero;Cottonwood;Esch;99;Lebanon;Lebanon;Lebanon;Lebanon;Proin interdum mauris non ligula pellentesque ultrices. Phasellus id sapien in sapien iaculis congue. Vivamus metus arcu, adipiscing molestie, hendrerit at, vulputate vitae, nisl.
Robin;Katherine;Frazier;Fernandez;C;1002003000;;6-(299)059-8214;;kfernandezku@desdev.cn;;CLIENTE;El Angel;13/07/2014;F;SI;VIUDO;2;Clove;Waubesa;759;China;Brazil;Brazil;;Praesent id massa id nisl venenatis lacinia. Aenean sit amet justo. Morbi ut odio.;Costurero;Melvin;5th;44;Brazil;Brazil;Brazil;Brazil;"Donec diam neque, vestibulum eget, vulputate ut, ultrices vel, augue. Vestibulum ante ipsum primis in faucibus orci luctus et ultrices posuere cubilia Curae; Donec pharetra, magna vestibulum aliquet ultrices, erat tortor sollicitudin mi, sit amet lobortis sapien sapien non mi. Integer ac neque."
Rebecca;Jennifer;Adams;Gomez;C;1004002000;;8-(865)513-4239;8-(128)404-9224;jgomezkv@printfriendly.com;;CLIENTE;Urcuqui;31/01/2014;F;NO;SOLTERO;2;Stang;8th;32986;;Cuba;Cuba;Cuba;Nullam sit amet turpis elementum ligula vehicula consequat. Morbi a ipsum. Integer a nibh.;Digitado;8th;Lyons;3;Cuba;Cuba;Cuba;Cuba;Morbi porttitor lorem id ligula. Suspendisse ornare consequat lectus. In est risus, auctor sed, tristique in, tempus sit amet, sem.
Lawrence;Patricia;Moreno;George;C;1004002000;;0-(683)913-5386;0-(070)486-7080;;Duis aliquam convallis nunc. Proin at turpis a pede posuere nonummy. Integer non velit.;CLIENTE;Urcuqui;22/01/2014;M;NO;VIUDO;3;Dapin;Dennis;47835;Uzbekistan;Reunion;Reunion;Reunion;;Mecánico;Clyde Gallagher;Green;559;Reunion;Reunion;Reunion;Reunion;Proin eu mi. Nulla ac enim. In tempor, turpis nec euismod scelerisque, quam turpis adipiscing lorem, vitae mattis nibh ligula nec sem.
Douglas;Helen;Kim;Larson;C;1002003000;;9-(608)523-3516;;;;CLIENTE;Mira;22/08/2014;F;NO;SOLTERO;;Derek;Stang;4;Indonesia;Benin;Benin;Benin;Curabitur in libero ut massa volutpat convallis. Morbi odio odio, elementum eu, interdum eu, tincidunt in, leo. Maecenas pulvinar lobortis est.;Heladero;Erie;Maryland;2;Benin;Benin;Benin;;Quisque porta volutpat erat. Quisque erat eros, viverra eget, congue eget, semper rutrum, nulla. Nunc purus.
