PRIMER NOMBRE;SEGUNDO NOMBRE;APELLIDO PATERNO;APELLIDO MATERNO;TIPO IDENTIFICACION;CEDULA/PASAPORTE;RUC;TELEFONO;CELULAR;CORREO;DESCRIPCION DE SOCIO;TIPO DE SOCIO;SUCURSAL REGISTRO;FECHA NACIMIENTO;GENERO;DISCAPACIDAD;ESTADO CIVIL;Nro CARGAS FAMILIARES;DOMICILIO CALLE PRINCIPAL;DOMICILIO CALLE SECUNDARIA;DOMICILIO Nro Vivienda;DOMICILIO PROVINCIA;DOMICILIO CANTON;DOMICILIO PARROQUIA;DOMICILIO BARRIO;DOMICILIO REFERENCIA;ACTIVIDAD ECONOMICA;NEGOCIO CALLE PRINCIPAL;NEGOCIO CALLE SECUNDARIA;NEGOCIO Nro Vivienda;NEGOCIO PROVINCIA;NEGOCIO CANTON;NEGOCIO PARROQUIA;NEGOCIO BARRIO;NEGOCIO REFERENCIA
Randy;Johnny;Garza;Fox;C;1002003000;;9-(445)984-4239;9-(386)289-5094;jfoxdf@google.com.br;"Maecenas tristique, est et tempus semper, est quam pharetra magna, ac consequat metus sapien ut nunc. Vestibulum ante ipsum primis in faucibus orci luctus et ultrices posuere cubilia Curae; Mauris viverra diam vitae quam. Suspendisse potenti.

Nullam porttitor lacus at turpis. Donec posuere metus vitae ipsum. Aliquam non mauris.";CLIENTE;Mira;31/12/2013;M;SI;DIVORCIADO;0;8th;Bobwhite;87;Portugal;Colombia;Colombia;Colombia;Phasellus sit amet erat. Nulla tempus. Vivamus in felis eu sapien cursus vestibulum.;Escultor;Arapahoe;Kingsford;51;Colombia;Colombia;Colombia;Colombia;Aenean fermentum. Donec ut mauris eget massa tempor convallis. Nulla neque libero, convallis eget, eleifend luctus, ultricies eu, nibh.
Julia;Dorothy;Flores;Richardson;C;1002003000;;;3-(494)403-4022;drichardsondg@pcworld.com;;CLIENTE;El Angel;19/07/2014;F;NO;VIUDO;0;;American Ash;772;Argentina;Indonesia;Indonesia;Indonesia;"Donec diam neque, vestibulum eget, vulputate ut, ultrices vel, augue. Vestibulum ante ipsum primis in faucibus orci luctus et ultrices posuere cubilia Curae; Donec pharetra, magna vestibulum aliquet ultrices, erat tortor sollicitudin mi, sit amet lobortis sapien sapien non mi. Integer ac neque.";Tendero;Westerfield;Vernon;9;Indonesia;Indonesia;Indonesia;Indonesia;Aliquam quis turpis eget elit sodales scelerisque. Mauris sit amet eros. Suspendisse accumsan tortor quis turpis.
Andrea;Nancy;Freeman;Gray;P;1002003000;;1-(430)855-3643;8-(694)035-2429;ngraydh@mac.com;"Suspendisse potenti. In eleifend quam a odio. In hac habitasse platea dictumst.

Maecenas ut massa quis augue luctus tincidunt. Nulla mollis molestie lorem. Quisque ut erat.";GARANTE;Pimampiro;25/02/2014;M;NO;DIVORCIADO;;Jenifer;Farragut;69;Mexico;Russia;;Russia;In congue. Etiam justo. Etiam pretium iaculis justo.;Mecánico;Oxford;Kedzie;815;Russia;Russia;Russia;Russia;Aenean lectus. Pellentesque eget nunc. Donec quis orci eget orci vehicula condimentum.
James;Norma;Sanchez;Williams;C;1004002000;;0-(053)504-2995;3-(499)056-7305;;"Duis consequat dui nec nisi volutpat eleifend. Donec ut dolor. Morbi vel lectus in quam fringilla rhoncus.

Mauris enim leo, rhoncus sed, vestibulum sit amet, cursus id, turpis. Integer aliquet, massa id lobortis convallis, tortor risus dapibus augue, vel accumsan tellus nisi eu orci. Mauris lacinia sapien quis libero.";GARANTE;Pimampiro;04/08/2014;F;NO;;1;Chinook;Michigan;1741;China;Indonesia;Indonesia;Indonesia;Suspendisse potenti. In eleifend quam a odio. In hac habitasse platea dictumst.;Panadero;Haas;Melrose;93;Indonesia;Indonesia;Indonesia;;Suspendisse potenti. In eleifend quam a odio. In hac habitasse platea dictumst.
Ruby;Johnny;Young;Greene;P;1002003000;;4-(393)003-4066;6-(665)973-4040;;;CLIENTE;Pimampiro;23/03/2014;M;NO;DIVORCIADO;;Hovde;Killdeer;90440;Croatia;Portugal;Portugal;;;Carnicero;Carpenter;Sutteridge;533;Portugal;;Portugal;Portugal;Sed ante. Vivamus tortor. Duis mattis egestas metus.
Robin;Edward;Romero;Robertson;P;1002003000;;1-(723)378-5354;;;;CLIENTE;Pimampiro;22/11/2013;M;NO;DIVORCIADO;0;Kensington;Arizona;3;;Indonesia;Indonesia;Indonesia;Nulla ut erat id mauris vulputate elementum. Nullam varius. Nulla facilisi.;Digitado;Carioca;Northport;10315;Indonesia;;Indonesia;;Curabitur gravida nisi at nibh. In hac habitasse platea dictumst. Aliquam augue quam, sollicitudin vitae, consectetuer eget, rutrum at, lorem.
Virginia;Jonathan;Boyd;Garrett;C;1002003000;;2-(047)927-0719;8-(602)991-5002;jgarrettdm@example.com;;CLIENTE;El Angel;26/01/2014;M;NO;VIUDO;2;Clarendon;Bay;81158;Norway;China;China;China;Maecenas ut massa quis augue luctus tincidunt. Nulla mollis molestie lorem. Quisque ut erat.;Mecánico;Erie;Hintze;2005;;China;China;China;Etiam vel augue. Vestibulum rutrum rutrum neque. Aenean auctor gravida sem.
Roger;James;Stone;Medina;C;1002003000;;9-(618)533-4884;6-(552)394-6703;jmedinadn@utexas.edu;Lorem ipsum dolor sit amet, consectetuer adipiscing elit. Proin risus. Praesent lectus.;CLIENTE;El Angel;02/02/2014;M;NO;VIUDO;;Westridge;3rd;95946;China;China;China;China;Quisque porta volutpat erat. Quisque erat eros, viverra eget, congue eget, semper rutrum, nulla. Nunc purus.;Panadero;Michigan;Sundown;80;China;China;China;China;Cras non velit nec nisi vulputate nonummy. Maecenas tincidunt lacus at velit. Vivamus vel nulla eget eros elementum pellentesque.
Annie;Jean;Roberts;Nguyen;C;1002003000;;6-(675)210-6572;7-(459)725-6910;;;CLIENTE;El Angel;11/09/2014;M;NO;CASADO;0;6th;;25;Sweden;Mongolia;Mongolia;Mongolia;Aliquam quis turpis eget elit sodales scelerisque. Mauris sit amet eros. Suspendisse accumsan tortor quis turpis.;Comerciante;Boyd;Magdeline;1105;Mongolia;Mongolia;Mongolia;Mongolia;Pellentesque at nulla. Suspendisse potenti. Cras in purus eu magna vulputate luctus.
Jason;Harry;Bailey;Smith;C;1004002000;;2-(289)439-2628;6-(990)292-2594;hsmithdp@odnoklassniki.ru;;GARANTE;Urcuqui;31/05/2014;M;NO;VIUDO;;Express;Straubel;3971;Poland;Sweden;Sweden;Sweden;Fusce consequat. Nulla nisl. Nunc nisl.;Lechero;5th;Sauthoff;1;Sweden;Sweden;Sweden;Sweden;Integer tincidunt ante vel ipsum. Praesent blandit lacinia erat. Vestibulum sed magna at nunc commodo placerat.
Gerald;Alan;Chavez;Riley;P;1002003000;;4-(409)314-5745;4-(982)437-2180;arileydq@hostgator.com;Aliquam quis turpis eget elit sodales scelerisque. Mauris sit amet eros. Suspendisse accumsan tortor quis turpis.;CLIENTE;Mira;22/07/2014;M;NO;CASADO;;Mosinee;Larry;9;Poland;Lithuania;Lithuania;Lithuania;;Heladero;Springs;Sherman;87;Lithuania;Lithuania;Lithuania;Lithuania;Cras non velit nec nisi vulputate nonummy. Maecenas tincidunt lacus at velit. Vivamus vel nulla eget eros elementum pellentesque.
Patrick;Terry;Ray;Parker;C;1002003000;;9-(635)579-6046;1-(574)561-1697;;In sagittis dui vel nisl. Duis ac nibh. Fusce lacus purus, aliquet at, feugiat non, pretium quis, lectus.;CLIENTE;El Angel;26/09/2014;F;NO;CASADO;3;;Harbort;3;Argentina;Bosnia and Herzegovina;Bosnia and Herzegovina;Bosnia and Herzegovina;Aenean fermentum. Donec ut mauris eget massa tempor convallis. Nulla neque libero, convallis eget, eleifend luctus, ultricies eu, nibh.;Panadero;Arizona;Sunfield;87869;Bosnia and Herzegovina;Bosnia and Herzegovina;Bosnia and Herzegovina;;Curabitur gravida nisi at nibh. In hac habitasse platea dictumst. Aliquam augue quam, sollicitudin vitae, consectetuer eget, rutrum at, lorem.
Nicholas;Catherine;Oliver;;C;1002003000;;9-(032)967-1297;6-(134)416-0891;cboydds@yelp.com;;CLIENTE;;02/08/2014;F;NO;VIUDO;2;Ohio;Fordem;804;Poland;China;China;China;Phasellus sit amet erat. Nulla tempus. Vivamus in felis eu sapien cursus vestibulum.;Digitado;Dunning;Center;98;China;China;China;China;Duis consequat dui nec nisi volutpat eleifend. Donec ut dolor. Morbi vel lectus in quam fringilla rhoncus.
Raymond;Susan;Perry;Ray;P;1002003000;;7-(396)900-1418;6-(894)757-4970;sraydt@microsoft.com;"In congue. Etiam justo. Etiam pretium iaculis justo.

In hac habitasse platea dictumst. Etiam faucibus cursus urna. Ut tellus.";CLIENTE;El Angel;27/12/2013;M;NO;;3;Anderson;Steensland;1;Indonesia;Sweden;Sweden;Sweden;Morbi porttitor lorem id ligula. Suspendisse ornare consequat lectus. In est risus, auctor sed, tristique in, tempus sit amet, sem.;Escultor;Towne;Monument;56466;Sweden;Sweden;Sweden;Sweden;Cras mi pede, malesuada in, imperdiet et, commodo vulputate, justo. In blandit ultrices enim. Lorem ipsum dolor sit amet, consectetuer adipiscing elit.
Denise;Louis;Ferguson;Berry;C;1002003000;;4-(641)946-1685;3-(282)987-7445;lberrydu@microsoft.com;Nullam porttitor lacus at turpis. Donec posuere metus vitae ipsum. Aliquam non mauris.;CLIENTE;Mira;28/08/2014;M;SI;DIVORCIADO;1;Linden;Springs;30231;China;Russia;Russia;Russia;Aenean fermentum. Donec ut mauris eget massa tempor convallis. Nulla neque libero, convallis eget, eleifend luctus, ultricies eu, nibh.;Artesano;;Warner;5;Russia;Russia;Russia;Russia;Aenean lectus. Pellentesque eget nunc. Donec quis orci eget orci vehicula condimentum.
Patrick;Diana;Carr;Perez;C;1002003000;;8-(890)036-8751;6-(547)358-5329;dperezdv@bluehost.com;"Nulla ut erat id mauris vulputate elementum. Nullam varius. Nulla facilisi.

Cras non velit nec nisi vulputate nonummy. Maecenas tincidunt lacus at velit. Vivamus vel nulla eget eros elementum pellentesque.";CLIENTE;Mira;10/04/2014;F;NO;DIVORCIADO;0;Nevada;Troy;873;China;Russia;Russia;Russia;Morbi non lectus. Aliquam sit amet diam in magna bibendum imperdiet. Nullam orci pede, venenatis non, sodales sed, tincidunt eu, felis.;Lechero;Prairie Rose;Buhler;86038;Russia;Russia;Russia;Russia;Morbi porttitor lorem id ligula. Suspendisse ornare consequat lectus. In est risus, auctor sed, tristique in, tempus sit amet, sem.
Denise;Joseph;Mills;Bryant;P;1004002000;;5-(886)736-6248;5-(806)584-8377;jbryantdw@ca.gov;"Nam ultrices, libero non mattis pulvinar, nulla pede ullamcorper augue, a suscipit nulla elit ac nulla. Sed vel enim sit amet nunc viverra dapibus. Nulla suscipit ligula in lacus.

Curabitur at ipsum ac tellus semper interdum. Mauris ullamcorper purus sit amet nulla. Quisque arcu libero, rutrum ac, lobortis vel, dapibus at, diam.";CLIENTE;Pimampiro;19/08/2014;M;NO;CASADO;;Grim;Straubel;6112;Czech Republic;;Guatemala;Guatemala;;Escultor;Walton;Hayes;;Guatemala;Guatemala;;;Mauris enim leo, rhoncus sed, vestibulum sit amet, cursus id, turpis. Integer aliquet, massa id lobortis convallis, tortor risus dapibus augue, vel accumsan tellus nisi eu orci. Mauris lacinia sapien quis libero.
Margaret;Sandra;Sanchez;Lane;C;1002003000;;6-(279)698-4556;0-(729)289-0123;;;CLIENTE;Urcuqui;19/06/2014;M;NO;SOLTERO;0;Lotheville;;1794;South Africa;Guatemala;Guatemala;Guatemala;In congue. Etiam justo. Etiam pretium iaculis justo.;Carnicero;Sunbrook;Artisan;131;Guatemala;Guatemala;Guatemala;Guatemala;Proin interdum mauris non ligula pellentesque ultrices. Phasellus id sapien in sapien iaculis congue. Vivamus metus arcu, adipiscing molestie, hendrerit at, vulputate vitae, nisl.
Michael;Matthew;Taylor;Simpson;P;1002003000;;2-(545)433-1244;7-(975)131-4018;msimpsondy@umich.edu;"Aliquam quis turpis eget elit sodales scelerisque. Mauris sit amet eros. Suspendisse accumsan tortor quis turpis.

Sed ante. Vivamus tortor. Duis mattis egestas metus.";CLIENTE;Urcuqui;29/03/2014;F;NO;CASADO;1;Summerview;Havey;73;France;France;France;France;Aenean fermentum. Donec ut mauris eget massa tempor convallis. Nulla neque libero, convallis eget, eleifend luctus, ultricies eu, nibh.;Carnicero;Towne;Clove;368;France;France;France;France;Duis consequat dui nec nisi volutpat eleifend. Donec ut dolor. Morbi vel lectus in quam fringilla rhoncus.
Earl;Katherine;Harvey;Murphy;C;1002003000;;0-(374)084-8160;3-(632)992-9275;kmurphydz@spotify.com;"Curabitur gravida nisi at nibh. In hac habitasse platea dictumst. Aliquam augue quam, sollicitudin vitae, consectetuer eget, rutrum at, lorem.

Integer tincidunt ante vel ipsum. Praesent blandit lacinia erat. Vestibulum sed magna at nunc commodo placerat.";CLIENTE;Urcuqui;12/10/2014;M;NO;CASADO;3;Grayhawk;Transport;70670;Indonesia;Indonesia;Indonesia;Indonesia;Cras non velit nec nisi vulputate nonummy. Maecenas tincidunt lacus at velit. Vivamus vel nulla eget eros elementum pellentesque.;Tendero;Bunker Hill;Anthes;9;Indonesia;Indonesia;Indonesia;Indonesia;Aenean fermentum. Donec ut mauris eget massa tempor convallis. Nulla neque libero, convallis eget, eleifend luctus, ultricies eu, nibh.
Howard;Maria;Thomas;Ramos;C;1004002000;;8-(657)270-6211;3-(505)772-1432;;;CLIENTE;Mira;21/07/2014;M;SI;CASADO;;Golf View;Tomscot;10;China;China;China;China;Sed sagittis. Nam congue, risus semper porta volutpat, quam pede lobortis ligula, sit amet eleifend pede libero quis orci. Nullam molestie nibh in lectus.;Costurero;;Elmside;;;China;China;China;Vestibulum ac est lacinia nisi venenatis tristique. Fusce congue, diam id ornare imperdiet, sapien urna pretium nisl, ut volutpat sapien arcu sed augue. Aliquam erat volutpat.
Gloria;Ralph;Riley;Hill;C;1004002000;;8-(373)663-0943;2-(197)852-6624;rhille1@istockphoto.com;;CLIENTE;El Angel;18/02/2014;F;SI;VIUDO;1;Rowland;Roth;61;Indonesia;Portugal;Portugal;Portugal;Maecenas leo odio, condimentum id, luctus nec, molestie sed, justo. Pellentesque viverra pede ac diam. Cras pellentesque volutpat dui.;Panadero;Lillian;Lakeland;755;Portugal;Portugal;Portugal;Portugal;Mauris enim leo, rhoncus sed, vestibulum sit amet, cursus id, turpis. Integer aliquet, massa id lobortis convallis, tortor risus dapibus augue, vel accumsan tellus nisi eu orci. Mauris lacinia sapien quis libero.
Larry;Ann;Arnold;Ray;C;1002003000;;2-(885)933-1015;2-(701)072-6339;;;CLIENTE;Pimampiro;16/09/2014;F;NO;CASADO;1;Porter;Walton;142;United States;South Korea;South Korea;South Korea;Duis bibendum. Morbi non quam nec dui luctus rutrum. Nulla tellus.;Costurero;Barby;Kim;43341;South Korea;South Korea;South Korea;South Korea;Mauris enim leo, rhoncus sed, vestibulum sit amet, cursus id, turpis. Integer aliquet, massa id lobortis convallis, tortor risus dapibus augue, vel accumsan tellus nisi eu orci. Mauris lacinia sapien quis libero.
Chris;Harry;Gray;Woods;C;1004002000;;4-(181)260-1829;;hwoodse3@virginia.edu;"Integer ac leo. Pellentesque ultrices mattis odio. Donec vitae nisi.

Nam ultrices, libero non mattis pulvinar, nulla pede ullamcorper augue, a suscipit nulla elit ac nulla. Sed vel enim sit amet nunc viverra dapibus. Nulla suscipit ligula in lacus.";CLIENTE;Mira;09/11/2014;F;NO;SOLTERO;;8th;Moulton;6;Portugal;Poland;Poland;Poland;Duis aliquam convallis nunc. Proin at turpis a pede posuere nonummy. Integer non velit.;Carnicero;Green;Blaine;1121;Poland;;Poland;Poland;Integer ac leo. Pellentesque ultrices mattis odio. Donec vitae nisi.
Pamela;Doris;Romero;Gibson;C;1002003000;;6-(205)920-3418;;dgibsone4@epa.gov;;CLIENTE;Pimampiro;11/04/2014;M;NO;CASADO;1;Erie;Parkside;55;China;China;China;China;Integer ac leo. Pellentesque ultrices mattis odio. Donec vitae nisi.;Costurero;Glacier Hill;Scott;214;China;China;China;China;
Dennis;Edward;Bishop;Richards;C;1004002000;;9-(688)128-0700;5-(878)807-2247;;;CLIENTE;Mira;16/10/2014;M;;CASADO;2;Mallory;Division;58888;Botswana;United States;United States;United States;Quisque porta volutpat erat. Quisque erat eros, viverra eget, congue eget, semper rutrum, nulla. Nunc purus.;Comerciante;Orin;Fallview;69;United States;;United States;United States;In hac habitasse platea dictumst. Morbi vestibulum, velit id pretium iaculis, diam erat fermentum justo, nec condimentum neque sapien placerat ante. Nulla justo.
Ernest;Marilyn;Sims;Mills;C;1002003000;;3-(278)307-5515;1-(309)526-7491;;"Morbi non lectus. Aliquam sit amet diam in magna bibendum imperdiet. Nullam orci pede, venenatis non, sodales sed, tincidunt eu, felis.

Fusce posuere felis sed lacus. Morbi sem mauris, laoreet ut, rhoncus aliquet, pulvinar sed, nisl. Nunc rhoncus dui vel sem.";CLIENTE;;17/11/2013;M;;SOLTERO;2;Rutledge;Manufacturers;45414;Indonesia;China;;China;"Maecenas tristique, est et tempus semper, est quam pharetra magna, ac consequat metus sapien ut nunc. Vestibulum ante ipsum primis in faucibus orci luctus et ultrices posuere cubilia Curae; Mauris viverra diam vitae quam. Suspendisse potenti.";Lechero;Forest;Clarendon;6;China;China;China;China;Etiam vel augue. Vestibulum rutrum rutrum neque. Aenean auctor gravida sem.
Paula;Laura;Cook;Wheeler;C;1002003000;;2-(980)133-9987;0-(518)215-9409;;Nullam sit amet turpis elementum ligula vehicula consequat. Morbi a ipsum. Integer a nibh.;CLIENTE;Mira;29/04/2014;F;NO;CASADO;3;Loomis;Oakridge;76233;Indonesia;Peru;Peru;Peru;;Panadero;Armistice;Nelson;18963;Peru;Peru;Peru;Peru;Aenean lectus. Pellentesque eget nunc. Donec quis orci eget orci vehicula condimentum.
Kimberly;Carolyn;Payne;Evans;C;1002003000;;9-(885)354-0387;0-(592)989-1109;cevanse8@pagesperso-orange.fr;Praesent id massa id nisl venenatis lacinia. Aenean sit amet justo. Morbi ut odio.;CLIENTE;Mira;12/06/2014;M;NO;SOLTERO;3;Warrior;Ilene;243;Brazil;Australia;Australia;Australia;Sed sagittis. Nam congue, risus semper porta volutpat, quam pede lobortis ligula, sit amet eleifend pede libero quis orci. Nullam molestie nibh in lectus.;Mecánico;Dwight;Roxbury;3;Australia;Australia;Australia;Australia;"Donec diam neque, vestibulum eget, vulputate ut, ultrices vel, augue. Vestibulum ante ipsum primis in faucibus orci luctus et ultrices posuere cubilia Curae; Donec pharetra, magna vestibulum aliquet ultrices, erat tortor sollicitudin mi, sit amet lobortis sapien sapien non mi. Integer ac neque."
Rachel;Pamela;Carroll;Murphy;C;1002003000;;8-(102)585-1125;9-(586)700-8100;;"Nullam porttitor lacus at turpis. Donec posuere metus vitae ipsum. Aliquam non mauris.

Morbi non lectus. Aliquam sit amet diam in magna bibendum imperdiet. Nullam orci pede, venenatis non, sodales sed, tincidunt eu, felis.";CLIENTE;Pimampiro;11/10/2014;M;NO;SOLTERO;;La Follette;Corry;5;Canada;New Zealand;New Zealand;New Zealand;In hac habitasse platea dictumst. Morbi vestibulum, velit id pretium iaculis, diam erat fermentum justo, nec condimentum neque sapien placerat ante. Nulla justo.;Heladero;Amoth;Banding;8849;New Zealand;New Zealand;New Zealand;New Zealand;Maecenas leo odio, condimentum id, luctus nec, molestie sed, justo. Pellentesque viverra pede ac diam. Cras pellentesque volutpat dui.
Roy;Ashley;Coleman;Carpenter;C;1004002000;;1-(959)232-5733;6-(004)160-8072;;"Quisque id justo sit amet sapien dignissim vestibulum. Vestibulum ante ipsum primis in faucibus orci luctus et ultrices posuere cubilia Curae; Nulla dapibus dolor vel est. Donec odio justo, sollicitudin ut, suscipit a, feugiat et, eros.";CLIENTE;El Angel;16/06/2014;M;NO;CASADO;2;;Gulseth;690;Poland;Thailand;Thailand;Thailand;In hac habitasse platea dictumst. Etiam faucibus cursus urna. Ut tellus.;Carnicero;Lindbergh;Melvin;;Thailand;Thailand;Thailand;Thailand;Curabitur in libero ut massa volutpat convallis. Morbi odio odio, elementum eu, interdum eu, tincidunt in, leo. Maecenas pulvinar lobortis est.
Russell;Mark;Wheeler;West;C;1004002000;;2-(681)602-8180;0-(925)803-2002;mwesteb@wiley.com;;CLIENTE;Pimampiro;10/02/2014;M;NO;VIUDO;3;Waxwing;Karstens;0;China;China;China;China;Duis bibendum. Morbi non quam nec dui luctus rutrum. Nulla tellus.;Panadero;School;Upham;489;China;China;China;China;Vestibulum ac est lacinia nisi venenatis tristique. Fusce congue, diam id ornare imperdiet, sapien urna pretium nisl, ut volutpat sapien arcu sed augue. Aliquam erat volutpat.
Dorothy;Peter;Rodriguez;Robinson;C;1002003000;;0-(237)241-5852;2-(489)132-6839;probinsonec@slashdot.org;"Duis consequat dui nec nisi volutpat eleifend. Donec ut dolor. Morbi vel lectus in quam fringilla rhoncus.

Mauris enim leo, rhoncus sed, vestibulum sit amet, cursus id, turpis. Integer aliquet, massa id lobortis convallis, tortor risus dapibus augue, vel accumsan tellus nisi eu orci. Mauris lacinia sapien quis libero.";CLIENTE;Urcuqui;05/12/2013;F;NO;SOLTERO;4;Magdeline;Texas;9;Argentina;Brazil;Brazil;Brazil;Nullam porttitor lacus at turpis. Donec posuere metus vitae ipsum. Aliquam non mauris.;Digitado;Sunnyside;Pond;594;Brazil;Brazil;Brazil;Brazil;Pellentesque at nulla. Suspendisse potenti. Cras in purus eu magna vulputate luctus.
David;Adam;Hughes;Green;C;1004002000;;0-(941)223-0830;0-(029)018-6254;agreened@yelp.com;;CLIENTE;El Angel;03/05/2014;F;NO;CASADO;1;Ohio;Loomis;;Poland;Colombia;Colombia;Colombia;Mauris enim leo, rhoncus sed, vestibulum sit amet, cursus id, turpis. Integer aliquet, massa id lobortis convallis, tortor risus dapibus augue, vel accumsan tellus nisi eu orci. Mauris lacinia sapien quis libero.;Tendero;;Lukken;8459;Colombia;Colombia;Colombia;Colombia;Maecenas leo odio, condimentum id, luctus nec, molestie sed, justo. Pellentesque viverra pede ac diam. Cras pellentesque volutpat dui.
Clarence;Kathleen;Reed;Lawrence;C;1002003000;;0-(856)093-6706;4-(746)877-4130;;;CLIENTE;;28/08/2014;M;NO;CASADO;;Red Cloud;Elgar;35892;Indonesia;Ukraine;Ukraine;Ukraine;Nullam porttitor lacus at turpis. Donec posuere metus vitae ipsum. Aliquam non mauris.;Digitado;;Straubel;9178;Ukraine;Ukraine;Ukraine;Ukraine;In hac habitasse platea dictumst. Morbi vestibulum, velit id pretium iaculis, diam erat fermentum justo, nec condimentum neque sapien placerat ante. Nulla justo.
Johnny;Dorothy;Harper;Ward;C;1004002000;;6-(572)117-8626;9-(548)796-3798;;Integer tincidunt ante vel ipsum. Praesent blandit lacinia erat. Vestibulum sed magna at nunc commodo placerat.;GARANTE;El Angel;27/02/2014;M;NO;DIVORCIADO;4;;;42;China;China;China;China;Integer tincidunt ante vel ipsum. Praesent blandit lacinia erat. Vestibulum sed magna at nunc commodo placerat.;Carnicero;Norway Maple;Hanson;29002;China;China;China;China;Morbi porttitor lorem id ligula. Suspendisse ornare consequat lectus. In est risus, auctor sed, tristique in, tempus sit amet, sem.
Joe;Frank;Snyder;Turner;C;1002003000;;4-(752)428-0499;0-(926)593-4540;;"Mauris enim leo, rhoncus sed, vestibulum sit amet, cursus id, turpis. Integer aliquet, massa id lobortis convallis, tortor risus dapibus augue, vel accumsan tellus nisi eu orci. Mauris lacinia sapien quis libero.

Nullam sit amet turpis elementum ligula vehicula consequat. Morbi a ipsum. Integer a nibh.";CLIENTE;Urcuqui;12/08/2014;F;NO;SOLTERO;2;Kennedy;Hooker;269;Colombia;Yemen;Yemen;Yemen;Curabitur at ipsum ac tellus semper interdum. Mauris ullamcorper purus sit amet nulla. Quisque arcu libero, rutrum ac, lobortis vel, dapibus at, diam.;Comerciante;Northwestern;Marquette;4863;Yemen;Yemen;Yemen;Yemen;In congue. Etiam justo. Etiam pretium iaculis justo.
Michelle;Johnny;Roberts;Hawkins;C;1004002000;;8-(484)986-8045;5-(665)605-8153;;;CLIENTE;Pimampiro;22/09/2014;M;SI;VIUDO;4;Cody;Havey;3423;New Zealand;Indonesia;Indonesia;Indonesia;"Maecenas tristique, est et tempus semper, est quam pharetra magna, ac consequat metus sapien ut nunc. Vestibulum ante ipsum primis in faucibus orci luctus et ultrices posuere cubilia Curae; Mauris viverra diam vitae quam. Suspendisse potenti.";Artesano;Maple;Carey;3;Indonesia;Indonesia;Indonesia;;Proin interdum mauris non ligula pellentesque ultrices. Phasellus id sapien in sapien iaculis congue. Vivamus metus arcu, adipiscing molestie, hendrerit at, vulputate vitae, nisl.
Antonio;Julie;Jenkins;Hanson;C;1004002000;;3-(425)508-6252;;;;CLIENTE;El Angel;28/05/2014;F;NO;SOLTERO;1;Monument;Fallview;3;Bulgaria;South Korea;South Korea;South Korea;In hac habitasse platea dictumst. Etiam faucibus cursus urna. Ut tellus.;Artesano;Pleasure;Basil;;South Korea;South Korea;South Korea;South Korea;Praesent blandit. Nam nulla. Integer pede justo, lacinia eget, tincidunt eget, tempus vel, pede.
Heather;Andrea;Kelly;Brooks;C;1002003000;;6-(692)517-2070;3-(714)964-6412;;;GARANTE;Mira;03/04/2014;F;SI;CASADO;0;Heffernan;Loftsgordon;46;Russia;Indonesia;Indonesia;Indonesia;Cras mi pede, malesuada in, imperdiet et, commodo vulputate, justo. In blandit ultrices enim. Lorem ipsum dolor sit amet, consectetuer adipiscing elit.;Digitado;Bonner;Fisk;1;Indonesia;Indonesia;Indonesia;Indonesia;Aenean fermentum. Donec ut mauris eget massa tempor convallis. Nulla neque libero, convallis eget, eleifend luctus, ultricies eu, nibh.
Nicole;Judith;Mcdonald;Nichols;P;1002003000;;6-(156)679-5495;4-(782)660-7684;;Aenean fermentum. Donec ut mauris eget massa tempor convallis. Nulla neque libero, convallis eget, eleifend luctus, ultricies eu, nibh.;CLIENTE;Mira;09/12/2013;M;NO;CASADO;2;Talisman;Mendota;6143;Peru;Lithuania;Lithuania;Lithuania;Fusce consequat. Nulla nisl. Nunc nisl.;Mecánico;Portage;Haas;445;Lithuania;Lithuania;Lithuania;Lithuania;In congue. Etiam justo. Etiam pretium iaculis justo.
Laura;Frank;Richards;Crawford;C;1002003000;;1-(767)124-8242;7-(677)607-4949;fcrawfordel@dmoz.org;;CLIENTE;El Angel;04/10/2014;F;NO;SOLTERO;0;Spenser;Troy;2;Brazil;China;China;China;Pellentesque at nulla. Suspendisse potenti. Cras in purus eu magna vulputate luctus.;Digitado;Oak Valley;Wayridge;9823;China;China;China;China;In congue. Etiam justo. Etiam pretium iaculis justo.
Robert;Lillian;Lopez;Freeman;C;1004002000;;7-(565)579-3890;2-(710)028-0456;lfreemanem@deliciousdays.com;;GARANTE;Urcuqui;05/10/2014;M;;CASADO;1;Londonderry;Crowley;82;Peru;Philippines;;Philippines;Integer ac leo. Pellentesque ultrices mattis odio. Donec vitae nisi.;Artesano;Bultman;7th;8;Philippines;Philippines;;Philippines;Curabitur at ipsum ac tellus semper interdum. Mauris ullamcorper purus sit amet nulla. Quisque arcu libero, rutrum ac, lobortis vel, dapibus at, diam.
Mildred;Robert;Phillips;Williams;C;1004002000;;4-(812)199-9929;5-(792)391-0071;;;CLIENTE;Pimampiro;26/09/2014;M;NO;SOLTERO;4;Swallow;Sloan;1;Guatemala;Russia;Russia;Russia;Sed ante. Vivamus tortor. Duis mattis egestas metus.;Tendero;;Almo;5665;Russia;Russia;Russia;Russia;"Vestibulum quam sapien, varius ut, blandit non, interdum in, ante. Vestibulum ante ipsum primis in faucibus orci luctus et ultrices posuere cubilia Curae; Duis faucibus accumsan odio. Curabitur convallis."
