PRIMER NOMBRE;SEGUNDO NOMBRE;APELLIDO PATERNO;APELLIDO MATERNO;TIPO IDENTIFICACION;CEDULA/PASAPORTE;RUC;TELEFONO;CELULAR;CORREO;DESCRIPCION DE SOCIO;TIPO DE SOCIO;SUCURSAL REGISTRO;FECHA NACIMIENTO;GENERO;DISCAPACIDAD;ESTADO CIVIL;Nro CARGAS FAMILIARES;DOMICILIO CALLE PRINCIPAL;DOMICILIO CALLE SECUNDARIA;DOMICILIO Nro Vivienda;DOMICILIO PROVINCIA;DOMICILIO CANTON;DOMICILIO PARROQUIA;DOMICILIO BARRIO;DOMICILIO REFERENCIA;ACTIVIDAD ECONOMICA;NEGOCIO CALLE PRINCIPAL;NEGOCIO CALLE SECUNDARIA;NEGOCIO Nro Vivienda;NEGOCIO PROVINCIA;NEGOCIO CANTON;NEGOCIO PARROQUIA;NEGOCIO BARRIO;NEGOCIO REFERENCIA
Andrea;Anna;Foster;Gray;C;1004002000;;6-(912)064-4388;2-(917)631-4487;agray0@cmu.edu;Maecenas leo odio, condimentum id, luctus nec, molestie sed, justo. Pellentesque viverra pede ac diam. Cras pellentesque volutpat dui.;GARANTE;Mira;02/03/2014;F;;CASADO;2;Barnett;Vernon;62513;;Afghanistan;Afghanistan;Afghanistan;Phasellus in felis. Donec semper sapien a libero. Nam dui.;Tendero;Arizona;Manitowish;8054;Afghanistan;Afghanistan;Afghanistan;Afghanistan;Sed sagittis. Nam congue, risus semper porta volutpat, quam pede lobortis ligula, sit amet eleifend pede libero quis orci. Nullam molestie nibh in lectus.
Michael;Ashley;Shaw;Gardner;C;1002003000;;9-(204)391-5739;4-(639)373-5742;agardner1@dailymotion.com;;CLIENTE;Mira;06/04/2014;M;NO;CASADO;0;Bunker Hill;Blaine;8;China;Netherlands;Netherlands;Netherlands;Suspendisse potenti. In eleifend quam a odio. In hac habitasse platea dictumst.;Tendero;Marcy;;64;Netherlands;Netherlands;Netherlands;Netherlands;Nam ultrices, libero non mattis pulvinar, nulla pede ullamcorper augue, a suscipit nulla elit ac nulla. Sed vel enim sit amet nunc viverra dapibus. Nulla suscipit ligula in lacus.
Gloria;Gerald;Wright;Willis;C;1002003000;;2-(456)501-9008;8-(328)811-3208;;;CLIENTE;Mira;14/04/2014;M;NO;CASADO;3;Barnett;Kingsford;8;Indonesia;China;China;;Suspendisse potenti. In eleifend quam a odio. In hac habitasse platea dictumst.;Artesano;Sunnyside;Blackbird;90472;China;China;China;China;Vestibulum ac est lacinia nisi venenatis tristique. Fusce congue, diam id ornare imperdiet, sapien urna pretium nisl, ut volutpat sapien arcu sed augue. Aliquam erat volutpat.
Gregory;Norma;Nguyen;Evans;C;1004002000;;5-(632)753-5433;3-(566)606-9205;nevans3@uol.com.br;"Maecenas ut massa quis augue luctus tincidunt. Nulla mollis molestie lorem. Quisque ut erat.

Curabitur gravida nisi at nibh. In hac habitasse platea dictumst. Aliquam augue quam, sollicitudin vitae, consectetuer eget, rutrum at, lorem.";CLIENTE;Pimampiro;23/07/2014;F;SI;SOLTERO;3;Farwell;Briar Crest;4176;United States;Indonesia;Indonesia;Indonesia;Integer tincidunt ante vel ipsum. Praesent blandit lacinia erat. Vestibulum sed magna at nunc commodo placerat.;Costurero;Cherokee;Susan;68;Indonesia;Indonesia;Indonesia;Indonesia;Quisque porta volutpat erat. Quisque erat eros, viverra eget, congue eget, semper rutrum, nulla. Nunc purus.
Albert;;Ortiz;Jackson;C;1002003000;;8-(371)639-6845;8-(773)416-6186;;;CLIENTE;Mira;25/07/2014;M;NO;SOLTERO;2;Scoville;Hoffman;2018;Mongolia;China;China;China;Quisque porta volutpat erat. Quisque erat eros, viverra eget, congue eget, semper rutrum, nulla. Nunc purus.;Heladero;Browning;Jenifer;99;China;China;China;China;"Quisque id justo sit amet sapien dignissim vestibulum. Vestibulum ante ipsum primis in faucibus orci luctus et ultrices posuere cubilia Curae; Nulla dapibus dolor vel est. Donec odio justo, sollicitudin ut, suscipit a, feugiat et, eros."
Theresa;Patricia;Foster;Palmer;C;1002003000;;7-(376)099-0264;6-(128)673-2418;ppalmer5@goo.ne.jp;;CLIENTE;Urcuqui;17/12/2013;F;NO;SOLTERO;1;Eggendart;Melvin;559;Russia;Poland;Poland;Poland;Proin leo odio, porttitor id, consequat in, consequat ut, nulla. Sed accumsan felis. Ut at dolor quis odio consequat varius.;Heladero;American;Hayes;;Poland;Poland;Poland;Poland;Praesent id massa id nisl venenatis lacinia. Aenean sit amet justo. Morbi ut odio.
Russell;Barbara;Bowman;Riley;C;1002003000;;1-(769)565-2064;5-(581)370-1524;;;GARANTE;Mira;08/07/2014;M;NO;SOLTERO;;3rd;Dennis;8;Indonesia;Tanzania;Tanzania;Tanzania;Cras mi pede, malesuada in, imperdiet et, commodo vulputate, justo. In blandit ultrices enim. Lorem ipsum dolor sit amet, consectetuer adipiscing elit.;Digitado;Saint Paul;Mesta;66;Tanzania;Tanzania;Tanzania;Tanzania;Curabitur in libero ut massa volutpat convallis. Morbi odio odio, elementum eu, interdum eu, tincidunt in, leo. Maecenas pulvinar lobortis est.
John;Sean;Hunt;Martinez;C;1002003000;;5-(401)612-0162;5-(699)681-5529;smartinez7@github.com;;GARANTE;Pimampiro;18/04/2014;M;NO;DIVORCIADO;0;Sachtjen;Dunning;94;Tanzania;China;;China;"Vestibulum quam sapien, varius ut, blandit non, interdum in, ante. Vestibulum ante ipsum primis in faucibus orci luctus et ultrices posuere cubilia Curae; Duis faucibus accumsan odio. Curabitur convallis.";Costurero;Reinke;;49;China;China;China;China;Integer ac leo. Pellentesque ultrices mattis odio. Donec vitae nisi.
Lisa;Mary;Perkins;Torres;C;1004002000;;4-(334)134-5435;9-(683)221-3727;;;CLIENTE;El Angel;22/05/2014;M;NO;SOLTERO;0;Stoughton;Vernon;7683;China;Japan;Japan;Japan;Duis aliquam convallis nunc. Proin at turpis a pede posuere nonummy. Integer non velit.;Digitado;6th;Holmberg;8;Japan;Japan;Japan;Japan;
Annie;Harry;Murphy;Alvarez;C;1002003000;;9-(638)559-1948;6-(583)362-0396;;Fusce posuere felis sed lacus. Morbi sem mauris, laoreet ut, rhoncus aliquet, pulvinar sed, nisl. Nunc rhoncus dui vel sem.;GARANTE;Mira;29/06/2014;M;NO;SOLTERO;2;8th;Harper;580;Philippines;Czech Republic;Czech Republic;Czech Republic;Fusce posuere felis sed lacus. Morbi sem mauris, laoreet ut, rhoncus aliquet, pulvinar sed, nisl. Nunc rhoncus dui vel sem.;Panadero;;Welch;5;Czech Republic;Czech Republic;Czech Republic;;Phasellus sit amet erat. Nulla tempus. Vivamus in felis eu sapien cursus vestibulum.
Wanda;Jeffrey;Barnes;Warren;C;1004002000;;2-(274)966-7729;2-(094)288-1563;;"Curabitur in libero ut massa volutpat convallis. Morbi odio odio, elementum eu, interdum eu, tincidunt in, leo. Maecenas pulvinar lobortis est.

Phasellus sit amet erat. Nulla tempus. Vivamus in felis eu sapien cursus vestibulum.";CLIENTE;Mira;18/06/2014;M;NO;SOLTERO;1;Novick;Fulton;5032;Indonesia;Colombia;Colombia;Colombia;;Mecánico;Eastwood;Cordelia;9;Colombia;Colombia;Colombia;Colombia;
Doris;Louis;Hayes;Freeman;C;1002003000;;3-(695)087-8359;1-(647)186-4207;;;CLIENTE;El Angel;03/09/2014;F;NO;SOLTERO;1;Knutson;Eliot;60882;China;Portugal;Portugal;Portugal;Duis bibendum. Morbi non quam nec dui luctus rutrum. Nulla tellus.;Tendero;Dayton;Dottie;584;Portugal;Portugal;Portugal;Portugal;
Jeffrey;Adam;Webb;Hamilton;C;1002003000;;2-(723)379-0670;9-(892)638-8236;;"In sagittis dui vel nisl. Duis ac nibh. Fusce lacus purus, aliquet at, feugiat non, pretium quis, lectus.

Suspendisse potenti. In eleifend quam a odio. In hac habitasse platea dictumst.";CLIENTE;Mira;13/10/2014;M;NO;SOLTERO;;Village Green;Cherokee;7;Poland;Portugal;Portugal;Portugal;Curabitur at ipsum ac tellus semper interdum. Mauris ullamcorper purus sit amet nulla. Quisque arcu libero, rutrum ac, lobortis vel, dapibus at, diam.;Mecánico;Lawn;Norway Maple;61884;Portugal;Portugal;Portugal;Portugal;Sed sagittis. Nam congue, risus semper porta volutpat, quam pede lobortis ligula, sit amet eleifend pede libero quis orci. Nullam molestie nibh in lectus.
Timothy;Linda;Ramos;Gonzales;C;1002003000;;8-(361)646-1941;5-(598)836-7714;;;CLIENTE;Mira;04/03/2014;M;NO;SOLTERO;1;Westridge;Shelley;65;Philippines;Russia;Russia;Russia;Nullam sit amet turpis elementum ligula vehicula consequat. Morbi a ipsum. Integer a nibh.;Mecánico;Old Shore;Bultman;4065;Russia;Russia;Russia;Russia;Sed sagittis. Nam congue, risus semper porta volutpat, quam pede lobortis ligula, sit amet eleifend pede libero quis orci. Nullam molestie nibh in lectus.
Kathy;Judy;Cunningham;Ross;C;1004002000;;5-(218)843-5168;3-(400)418-6876;;;CLIENTE;Urcuqui;02/09/2014;M;NO;SOLTERO;0;Straubel;Loeprich;;Kenya;Japan;Japan;Japan;Vestibulum ac est lacinia nisi venenatis tristique. Fusce congue, diam id ornare imperdiet, sapien urna pretium nisl, ut volutpat sapien arcu sed augue. Aliquam erat volutpat.;Comerciante;Barnett;Northridge;3;Japan;Japan;Japan;Japan;"Vestibulum quam sapien, varius ut, blandit non, interdum in, ante. Vestibulum ante ipsum primis in faucibus orci luctus et ultrices posuere cubilia Curae; Duis faucibus accumsan odio. Curabitur convallis."
Julie;Jane;White;Marshall;C;1002003000;;7-(928)527-0477;5-(155)652-7817;;"Maecenas ut massa quis augue luctus tincidunt. Nulla mollis molestie lorem. Quisque ut erat.

Curabitur gravida nisi at nibh. In hac habitasse platea dictumst. Aliquam augue quam, sollicitudin vitae, consectetuer eget, rutrum at, lorem.";CLIENTE;Mira;24/06/2014;M;NO;DIVORCIADO;3;Clemons;3rd;6573;Sweden;Indonesia;Indonesia;Indonesia;Cras mi pede, malesuada in, imperdiet et, commodo vulputate, justo. In blandit ultrices enim. Lorem ipsum dolor sit amet, consectetuer adipiscing elit.;Comerciante;;Brickson Park;72904;Indonesia;Indonesia;Indonesia;;Fusce consequat. Nulla nisl. Nunc nisl.
Scott;Earl;James;Gardner;C;1004002000;;3-(955)212-3909;5-(030)039-6848;egardnerg@histats.com;Aenean lectus. Pellentesque eget nunc. Donec quis orci eget orci vehicula condimentum.;CLIENTE;Pimampiro;28/11/2013;F;;SOLTERO;;Moulton;Debs;89;Thailand;;Poland;Poland;Maecenas leo odio, condimentum id, luctus nec, molestie sed, justo. Pellentesque viverra pede ac diam. Cras pellentesque volutpat dui.;Comerciante;Sachtjen;Dixon;977;Poland;Poland;Poland;Poland;"Vestibulum quam sapien, varius ut, blandit non, interdum in, ante. Vestibulum ante ipsum primis in faucibus orci luctus et ultrices posuere cubilia Curae; Duis faucibus accumsan odio. Curabitur convallis."
Justin;Phillip;Gibson;Bennett;C;1002003000;;6-(292)408-1809;7-(664)150-0943;pbennetth@ebay.com;;CLIENTE;El Angel;15/07/2014;M;SI;CASADO;3;Mayfield;Veith;267;Czech Republic;Indonesia;Indonesia;Indonesia;;Tendero;Northland;Sundown;17999;Indonesia;Indonesia;Indonesia;Indonesia;Curabitur at ipsum ac tellus semper interdum. Mauris ullamcorper purus sit amet nulla. Quisque arcu libero, rutrum ac, lobortis vel, dapibus at, diam.
Tina;Anne;Riley;Castillo;C;1002003000;;8-(207)468-2777;4-(647)180-5419;;;CLIENTE;Mira;18/08/2014;M;NO;CASADO;3;Knutson;Sunnyside;891;Indonesia;France;France;France;In hac habitasse platea dictumst. Morbi vestibulum, velit id pretium iaculis, diam erat fermentum justo, nec condimentum neque sapien placerat ante. Nulla justo.;Mecánico;Service;Gateway;99824;France;;France;France;Pellentesque at nulla. Suspendisse potenti. Cras in purus eu magna vulputate luctus.
Ronald;Ruby;Wallace;Oliver;C;1004002000;;8-(186)776-6402;3-(785)477-2545;roliverj@bing.com;;CLIENTE;El Angel;30/03/2014;F;SI;SOLTERO;;Fremont;Canary;100;Azerbaijan;United Kingdom;United Kingdom;;Nullam porttitor lacus at turpis. Donec posuere metus vitae ipsum. Aliquam non mauris.;Lechero;Judy;Bellgrove;734;United Kingdom;United Kingdom;United Kingdom;United Kingdom;Cum sociis natoque penatibus et magnis dis parturient montes, nascetur ridiculus mus. Vivamus vestibulum sagittis sapien. Cum sociis natoque penatibus et magnis dis parturient montes, nascetur ridiculus mus.
Betty;Carolyn;Butler;Barnes;C;1002003000;;6-(098)252-0037;0-(571)636-7741;cbarnesk@biblegateway.com;"Maecenas ut massa quis augue luctus tincidunt. Nulla mollis molestie lorem. Quisque ut erat.

Curabitur gravida nisi at nibh. In hac habitasse platea dictumst. Aliquam augue quam, sollicitudin vitae, consectetuer eget, rutrum at, lorem.";CLIENTE;Urcuqui;25/11/2013;M;NO;DIVORCIADO;1;Parkside;8th;695;Slovenia;;Indonesia;Indonesia;Cras mi pede, malesuada in, imperdiet et, commodo vulputate, justo. In blandit ultrices enim. Lorem ipsum dolor sit amet, consectetuer adipiscing elit.;Escultor;Texas;Grim;65358;Indonesia;Indonesia;Indonesia;Indonesia;Vestibulum ac est lacinia nisi venenatis tristique. Fusce congue, diam id ornare imperdiet, sapien urna pretium nisl, ut volutpat sapien arcu sed augue. Aliquam erat volutpat.
Jessica;;Johnston;Berry;C;1004002000;;9-(794)727-6221;9-(827)312-7856;cberryl@oaic.gov.au;;CLIENTE;Pimampiro;13/04/2014;M;SI;VIUDO;3;Redwing;Hauk;8686;Portugal;Indonesia;Indonesia;Indonesia;Aenean fermentum. Donec ut mauris eget massa tempor convallis. Nulla neque libero, convallis eget, eleifend luctus, ultricies eu, nibh.;Costurero;Katie;Graedel;547;Indonesia;Indonesia;Indonesia;Indonesia;In sagittis dui vel nisl. Duis ac nibh. Fusce lacus purus, aliquet at, feugiat non, pretium quis, lectus.
Jerry;Nicholas;Mitchell;Wagner;P;1002003000;;5-(781)069-4390;1-(827)098-1342;nwagnerm@nymag.com;"Vestibulum quam sapien, varius ut, blandit non, interdum in, ante. Vestibulum ante ipsum primis in faucibus orci luctus et ultrices posuere cubilia Curae; Duis faucibus accumsan odio. Curabitur convallis.

Duis consequat dui nec nisi volutpat eleifend. Donec ut dolor. Morbi vel lectus in quam fringilla rhoncus.";CLIENTE;Mira;09/04/2014;M;NO;SOLTERO;2;Westerfield;Service;934;Indonesia;China;China;China;Suspendisse potenti. In eleifend quam a odio. In hac habitasse platea dictumst.;Mecánico;Coolidge;Boyd;1;China;China;China;China;Cum sociis natoque penatibus et magnis dis parturient montes, nascetur ridiculus mus. Vivamus vestibulum sagittis sapien. Cum sociis natoque penatibus et magnis dis parturient montes, nascetur ridiculus mus.
Lori;Keith;Palmer;Fisher;C;1004002000;;4-(451)705-6811;3-(536)286-4540;kfishern@umn.edu;;CLIENTE;El Angel;12/02/2014;F;NO;VIUDO;4;Prairieview;Northwestern;1615;China;Poland;Poland;Poland;Duis bibendum, felis sed interdum venenatis, turpis enim blandit mi, in porttitor pede justo eu massa. Donec dapibus. Duis at velit eu est congue elementum.;Heladero;Sherman;Packers;44;Poland;Poland;Poland;Poland;"Donec diam neque, vestibulum eget, vulputate ut, ultrices vel, augue. Vestibulum ante ipsum primis in faucibus orci luctus et ultrices posuere cubilia Curae; Donec pharetra, magna vestibulum aliquet ultrices, erat tortor sollicitudin mi, sit amet lobortis sapien sapien non mi. Integer ac neque."
Lisa;Andrew;Walker;Oliver;C;1004002000;;8-(099)446-7255;0-(987)331-4878;aolivero@skype.com;;CLIENTE;Pimampiro;26/01/2014;M;NO;CASADO;1;5th;Drewry;3;Indonesia;Vietnam;Vietnam;Vietnam;Mauris enim leo, rhoncus sed, vestibulum sit amet, cursus id, turpis. Integer aliquet, massa id lobortis convallis, tortor risus dapibus augue, vel accumsan tellus nisi eu orci. Mauris lacinia sapien quis libero.;Mecánico;Brown;Shelley;41618;Vietnam;Vietnam;Vietnam;Vietnam;Nulla ut erat id mauris vulputate elementum. Nullam varius. Nulla facilisi.
Russell;Ruth;Gutierrez;;C;1002003000;;4-(436)927-3042;7-(875)391-2604;rberryp@networksolutions.com;Fusce consequat. Nulla nisl. Nunc nisl.;CLIENTE;El Angel;09/09/2014;F;NO;CASADO;1;Coolidge;Pawling;92;China;France;France;France;Nam ultrices, libero non mattis pulvinar, nulla pede ullamcorper augue, a suscipit nulla elit ac nulla. Sed vel enim sit amet nunc viverra dapibus. Nulla suscipit ligula in lacus.;Carnicero;Anthes;Portage;;France;France;France;France;Aenean lectus. Pellentesque eget nunc. Donec quis orci eget orci vehicula condimentum.
Steve;Juan;Fernandez;Hansen;C;1004002000;;0-(629)558-6326;6-(174)939-4669;;"Phasellus in felis. Donec semper sapien a libero. Nam dui.

Proin leo odio, porttitor id, consequat in, consequat ut, nulla. Sed accumsan felis. Ut at dolor quis odio consequat varius.";CLIENTE;Pimampiro;30/03/2014;F;NO;CASADO;1;Susan;Moose;85;Mauritius;Peru;Peru;Peru;In hac habitasse platea dictumst. Morbi vestibulum, velit id pretium iaculis, diam erat fermentum justo, nec condimentum neque sapien placerat ante. Nulla justo.;Heladero;Towne;Carberry;7540;Peru;Peru;Peru;Peru;In hac habitasse platea dictumst. Etiam faucibus cursus urna. Ut tellus.
Paul;Deborah;Moore;Butler;C;1004002000;;7-(524)992-3939;3-(946)236-1411;;;CLIENTE;Pimampiro;03/02/2014;M;NO;DIVORCIADO;2;Sullivan;Butternut;21;Botswana;Ireland;;Ireland;Morbi porttitor lorem id ligula. Suspendisse ornare consequat lectus. In est risus, auctor sed, tristique in, tempus sit amet, sem.;Heladero;Waywood;Debs;3;Ireland;Ireland;Ireland;Ireland;Proin leo odio, porttitor id, consequat in, consequat ut, nulla. Sed accumsan felis. Ut at dolor quis odio consequat varius.
Cheryl;Kevin;Cox;Jenkins;C;1002003000;;0-(813)935-5231;5-(421)439-1153;kjenkinss@wikimedia.org;;CLIENTE;El Angel;12/04/2014;M;NO;SOLTERO;3;Steensland;Lien;4;Philippines;Thailand;Thailand;Thailand;"Maecenas tristique, est et tempus semper, est quam pharetra magna, ac consequat metus sapien ut nunc. Vestibulum ante ipsum primis in faucibus orci luctus et ultrices posuere cubilia Curae; Mauris viverra diam vitae quam. Suspendisse potenti.";Artesano;Crowley;Ohio;205;Thailand;Thailand;Thailand;Thailand;Mauris enim leo, rhoncus sed, vestibulum sit amet, cursus id, turpis. Integer aliquet, massa id lobortis convallis, tortor risus dapibus augue, vel accumsan tellus nisi eu orci. Mauris lacinia sapien quis libero.
Kelly;;Moore;Simmons;C;1002003000;;2-(078)121-2612;7-(431)519-2009;lsimmonst@msu.edu;;GARANTE;Urcuqui;24/12/2013;M;SI;SOLTERO;4;Wayridge;American;582;China;Mexico;;Mexico;In hac habitasse platea dictumst. Morbi vestibulum, velit id pretium iaculis, diam erat fermentum justo, nec condimentum neque sapien placerat ante. Nulla justo.;Digitado;;Fairfield;38;Mexico;Mexico;Mexico;Mexico;Duis consequat dui nec nisi volutpat eleifend. Donec ut dolor. Morbi vel lectus in quam fringilla rhoncus.
Edward;Juan;Nguyen;Murphy;C;1004002000;;2-(182)379-1615;1-(763)837-2726;jmurphyu@fastcompany.com;;CLIENTE;Urcuqui;13/06/2014;F;NO;SOLTERO;0;Dryden;Kinsman;5;China;United States;United States;United States;Curabitur at ipsum ac tellus semper interdum. Mauris ullamcorper purus sit amet nulla. Quisque arcu libero, rutrum ac, lobortis vel, dapibus at, diam.;Comerciante;Sommers;East;71;United States;United States;United States;United States;"Donec diam neque, vestibulum eget, vulputate ut, ultrices vel, augue. Vestibulum ante ipsum primis in faucibus orci luctus et ultrices posuere cubilia Curae; Donec pharetra, magna vestibulum aliquet ultrices, erat tortor sollicitudin mi, sit amet lobortis sapien sapien non mi. Integer ac neque."
Angela;Joe;Day;Jacobs;C;1002003000;;9-(903)208-3166;3-(122)877-6615;;;CLIENTE;Mira;24/11/2013;M;;CASADO;0;Emmet;Dovetail;31;Russia;;Canada;Canada;In hac habitasse platea dictumst. Morbi vestibulum, velit id pretium iaculis, diam erat fermentum justo, nec condimentum neque sapien placerat ante. Nulla justo.;Heladero;Kenwood;Luster;959;Canada;Canada;Canada;Canada;Duis bibendum, felis sed interdum venenatis, turpis enim blandit mi, in porttitor pede justo eu massa. Donec dapibus. Duis at velit eu est congue elementum.
Debra;Nicole;Gomez;Gardner;C;1004002000;;3-(066)709-7047;1-(884)376-4231;;;CLIENTE;Pimampiro;;F;SI;CASADO;0;Corben;Fairfield;8663;China;Indonesia;Indonesia;Indonesia;Cum sociis natoque penatibus et magnis dis parturient montes, nascetur ridiculus mus. Vivamus vestibulum sagittis sapien. Cum sociis natoque penatibus et magnis dis parturient montes, nascetur ridiculus mus.;Carnicero;Evergreen;American;9413;Indonesia;Indonesia;Indonesia;Indonesia;Morbi non lectus. Aliquam sit amet diam in magna bibendum imperdiet. Nullam orci pede, venenatis non, sodales sed, tincidunt eu, felis.
Larry;Linda;Franklin;Lewis;C;1004002000;;6-(135)658-1884;5-(185)867-3958;;"In hac habitasse platea dictumst. Etiam faucibus cursus urna. Ut tellus.

Nulla ut erat id mauris vulputate elementum. Nullam varius. Nulla facilisi.";CLIENTE;Pimampiro;08/08/2014;M;NO;DIVORCIADO;2;School;David;6;Ukraine;Saint Lucia;Saint Lucia;Saint Lucia;In hac habitasse platea dictumst. Morbi vestibulum, velit id pretium iaculis, diam erat fermentum justo, nec condimentum neque sapien placerat ante. Nulla justo.;Costurero;Shelley;Pepper Wood;4061;Saint Lucia;Saint Lucia;Saint Lucia;Saint Lucia;Quisque porta volutpat erat. Quisque erat eros, viverra eget, congue eget, semper rutrum, nulla. Nunc purus.
Tina;Jacqueline;Welch;Gutierrez;C;1004002000;;8-(014)925-8922;9-(301)434-0049;jgutierrezy@google.ru;Cum sociis natoque penatibus et magnis dis parturient montes, nascetur ridiculus mus. Vivamus vestibulum sagittis sapien. Cum sociis natoque penatibus et magnis dis parturient montes, nascetur ridiculus mus.;CLIENTE;Urcuqui;16/01/2014;M;NO;DIVORCIADO;3;Derek;Clarendon;5499;Norway;Portugal;Portugal;Portugal;Morbi non lectus. Aliquam sit amet diam in magna bibendum imperdiet. Nullam orci pede, venenatis non, sodales sed, tincidunt eu, felis.;Costurero;Mcguire;Hallows;334;Portugal;Portugal;Portugal;Portugal;Cum sociis natoque penatibus et magnis dis parturient montes, nascetur ridiculus mus. Vivamus vestibulum sagittis sapien. Cum sociis natoque penatibus et magnis dis parturient montes, nascetur ridiculus mus.
Nicholas;Sandra;Clark;Murphy;C;1002003000;;5-(142)321-7684;3-(452)485-2206;smurphyz@umich.edu;;CLIENTE;Urcuqui;07/07/2014;F;NO;CASADO;;Shasta;Melvin;6216;Russia;Philippines;Philippines;Philippines;Nullam porttitor lacus at turpis. Donec posuere metus vitae ipsum. Aliquam non mauris.;Carnicero;Larry;Ludington;28;Philippines;Philippines;Philippines;Philippines;Duis bibendum. Morbi non quam nec dui luctus rutrum. Nulla tellus.
Sara;Cheryl;James;Hunter;C;1004002000;;6-(841)528-6227;3-(276)413-2351;;;CLIENTE;Pimampiro;10/07/2014;F;SI;SOLTERO;1;Manufacturers;Melby;5864;Ukraine;Russia;Russia;Russia;Fusce posuere felis sed lacus. Morbi sem mauris, laoreet ut, rhoncus aliquet, pulvinar sed, nisl. Nunc rhoncus dui vel sem.;Comerciante;Moland;Killdeer;7;Russia;Russia;Russia;Russia;Maecenas leo odio, condimentum id, luctus nec, molestie sed, justo. Pellentesque viverra pede ac diam. Cras pellentesque volutpat dui.
Lawrence;Victor;Vasquez;Carroll;P;1002003000;;3-(597)806-0819;9-(570)022-8199;;Aliquam quis turpis eget elit sodales scelerisque. Mauris sit amet eros. Suspendisse accumsan tortor quis turpis.;CLIENTE;Pimampiro;21/11/2013;F;NO;SOLTERO;4;Melby;Hauk;77304;Poland;Sweden;Sweden;Sweden;Curabitur at ipsum ac tellus semper interdum. Mauris ullamcorper purus sit amet nulla. Quisque arcu libero, rutrum ac, lobortis vel, dapibus at, diam.;Digitado;Eagle Crest;Everett;718;Sweden;Sweden;Sweden;Sweden;Fusce posuere felis sed lacus. Morbi sem mauris, laoreet ut, rhoncus aliquet, pulvinar sed, nisl. Nunc rhoncus dui vel sem.
Linda;Stephanie;Ferguson;Clark;C;1004002000;;8-(612)638-0047;5-(888)877-0473;sclark12@tinyurl.com;;GARANTE;Urcuqui;02/07/2014;F;NO;DIVORCIADO;2;Burning Wood;Tennyson;37259;Uganda;Jamaica;Jamaica;Jamaica;Cras mi pede, malesuada in, imperdiet et, commodo vulputate, justo. In blandit ultrices enim. Lorem ipsum dolor sit amet, consectetuer adipiscing elit.;Heladero;2nd;Continental;16;Jamaica;Jamaica;Jamaica;Jamaica;Proin leo odio, porttitor id, consequat in, consequat ut, nulla. Sed accumsan felis. Ut at dolor quis odio consequat varius.
Jimmy;Joan;Romero;Rivera;C;1004002000;;1-(790)850-4352;5-(949)694-0380;;;CLIENTE;Mira;02/02/2014;M;NO;DIVORCIADO;0;Springview;Utah;32;Argentina;Brazil;Brazil;Brazil;Phasellus sit amet erat. Nulla tempus. Vivamus in felis eu sapien cursus vestibulum.;Comerciante;Delladonna;Brown;8608;Brazil;Brazil;Brazil;Brazil;In sagittis dui vel nisl. Duis ac nibh. Fusce lacus purus, aliquet at, feugiat non, pretium quis, lectus.
Samuel;Phyllis;Lynch;Warren;C;1002003000;;2-(656)719-5218;0-(114)571-1091;;;GARANTE;Mira;22/06/2014;M;NO;SOLTERO;2;Barnett;Iowa;3;China;Tunisia;Tunisia;Tunisia;Proin interdum mauris non ligula pellentesque ultrices. Phasellus id sapien in sapien iaculis congue. Vivamus metus arcu, adipiscing molestie, hendrerit at, vulputate vitae, nisl.;Lechero;Ronald Regan;Kipling;350;Tunisia;Tunisia;Tunisia;Tunisia;Nam ultrices, libero non mattis pulvinar, nulla pede ullamcorper augue, a suscipit nulla elit ac nulla. Sed vel enim sit amet nunc viverra dapibus. Nulla suscipit ligula in lacus.
Kimberly;Patrick;Campbell;Marshall;C;1002003000;;6-(026)330-8819;1-(793)801-9270;pmarshall15@narod.ru;Duis bibendum, felis sed interdum venenatis, turpis enim blandit mi, in porttitor pede justo eu massa. Donec dapibus. Duis at velit eu est congue elementum.;GARANTE;El Angel;26/12/2013;M;NO;CASADO;0;Hayes;Nova;2796;Indonesia;United States;United States;United States;Proin interdum mauris non ligula pellentesque ultrices. Phasellus id sapien in sapien iaculis congue. Vivamus metus arcu, adipiscing molestie, hendrerit at, vulputate vitae, nisl.;Digitado;Kenwood;Columbus;96981;United States;United States;United States;United States;Duis bibendum, felis sed interdum venenatis, turpis enim blandit mi, in porttitor pede justo eu massa. Donec dapibus. Duis at velit eu est congue elementum.
Julia;Phillip;Tucker;Meyer;C;1002003000;;2-(780)936-0007;3-(234)013-6299;;;CLIENTE;El Angel;20/04/2014;M;NO;CASADO;2;Dapin;Granby;9636;Brazil;France;France;France;Curabitur at ipsum ac tellus semper interdum. Mauris ullamcorper purus sit amet nulla. Quisque arcu libero, rutrum ac, lobortis vel, dapibus at, diam.;Digitado;Scofield;Hayes;730;France;France;France;France;Vestibulum ac est lacinia nisi venenatis tristique. Fusce congue, diam id ornare imperdiet, sapien urna pretium nisl, ut volutpat sapien arcu sed augue. Aliquam erat volutpat.
Charles;Thomas;Knight;Scott;P;1002003000;;3-(636)448-1107;9-(566)696-3219;;;CLIENTE;Mira;16/03/2014;M;SI;CASADO;;Oxford;Myrtle;4;Madagascar;Indonesia;Indonesia;Indonesia;Nullam porttitor lacus at turpis. Donec posuere metus vitae ipsum. Aliquam non mauris.;Tendero;Anderson;;4635;;Indonesia;Indonesia;Indonesia;Curabitur at ipsum ac tellus semper interdum. Mauris ullamcorper purus sit amet nulla. Quisque arcu libero, rutrum ac, lobortis vel, dapibus at, diam.
